OrderId,StopSequenceNumber,CargoChangeSequenceNumber,CargoChangeType,GeneralDescription,Weight,TruckNumber,TrailerNumber,Driver1Name,Driver2Name
"000000000250",8,1,"Hook","Nylon stockings and flash-frozen french fries",2132.27,"","468835055288","Samuel X. Benitez",""
"000000000250",8,2,"Unload","windows",8230.7,"9303501377","808126133967","Janice U. Grimes",""
"000000000250",10,1,"Load","Uranium and nylon stockings",7739.63,"","382244612304","Janice M. Irvin","Yancey Benitez"
"000000000250",10,2,"Unload","X-ray machine parts and krazy glue",1337.86,"852430089347","234345118407","Isaiah Lewis",""
"000000000250",11,1,"Drop","Ice cream cones, bricks and engine parts",9140.71,"828453198368","","Danielle Underwood",""
"000000000251",2,1,"Load","Machinery, krazy glue, quilts and turtle eggs",2043.92,"70139351449","41157912370","Nancy K. Smith",""
"000000000251",3,1,"Load","Windows, jogging pants and machinery",7823.15,"702584560348","764734093680","Roberta Yarbrough",""
"000000000251",4,1,"Load","Lobsters, ice cream cones and dogfood",368.85,"","360681144473","Oliver G. Edwards","Tammy Dawson"
"000000000251",4,2,"Drop","Nylon stockings and Caesar salad mix",5339.44,"377868277719","","Francis M. Underwood",""
"000000000251",5,1,"Load","potatoes",9641.38,"822817625789","664437868416","Xaviera E. Irvin",""
"000000000251",6,1,"Unload","jogging pants",4162.85,"352277767648","102173649300","Janice D. O'Toole",""
"000000000251",7,1,"Hook","Caesar salad mix",9730,"340830327699","952332815812","Mitchell O'Toole","Harriet Williams"
"000000000251",7,2,"Drop","Jogging pants, turtle eggs and lobsters",8884.32,"799616635950","621070579237","Alfred T. Williams-Anderson",""
"000000000251",8,1,"Load","Uranium, engine parts and orange juice",4801.74,"804695030254","480087644517","Mitchell Velazquez",""
"000000000251",9,1,"Load","Machinery, potatoes, Caesar salad mix and orange juice",2353.75,"","424910057629","Louise M. French",""
"000000000251",11,1,"Drop","Machinery and ice cream cones",5763.73,"","","Patricia H. Underwood",""
"000000000252",2,1,"Hook","ice cream cones",8417.96,"","439458828950","Harriet X. Kern",""
"000000000252",3,1,"Load","Dogfood, machinery and bricks",7169.69,"","116783470515","Alfred Anderson",""
"000000000252",3,2,"Unload","Flash-frozen french fries and x-ray machine parts",6434.33,"","952116192426","George O. Velazquez",""
"000000000252",4,1,"Hook","Bricks, engine parts and ice cream cones",8090.89,"","811265655331","Patricia Underwood",""
"000000000252",4,2,"Unload","Turtle eggs, ice cream cones and bricks",6144.87,"880984944177","","Quincy G. Harrison",""
"000000000252",5,1,"Load","Krazy glue and orange juice",8742.84,"985513070419","","Eduardo W. Perry",""
"000000000252",5,2,"Drop","Apples, uranium, potatoes and ice cream cones",7749.5,"744317567959","","Samuel A. Edwards-French",""
"000000000252",6,1,"Drop","potatoes",8673.63,"912577308749","155453689934","Roberta Grimes",""
"000000000252",7,1,"Drop","Apples and gold",8902.26,"","913060199015","Samuel Harrison-Williams",""
"000000000253",2,1,"Hook","Stovepipe hats, x-ray machine parts and ice cream cones",9554.99,"866779131884","913782126461","Tammy M. Yarbrough",""
"000000000253",3,1,"Load","Bricks, orange juice and engine parts",5939.73,"340921425457","511769364603","Quincy Mitchell-Irvin",""
"000000000253",3,2,"Drop","Uranium, Caesar salad mix and lobsters",9972.06,"422186197914","","Tammy Benitez",""
"000000000253",4,1,"Hook","X-ray machine parts, stovepipe hats and gold",6019.58,"599082085725","495567779234","George Anderson-Grimes",""
"000000000253",4,2,"Unload","Caesar salad mix, lobsters and quilts",6169.46,"","","Eduardo S. Edwards",""
"000000000253",8,1,"Unload","Machinery and x-ray machine parts",965.79,"","376290764094","Yancey Nelson-O'Toole",""
"000000000254",2,1,"Load","Turtle eggs and x-ray machine parts",490.79,"","883038685683","Tammy Xing Grimes",""
"000000000254",3,1,"Hook","Krazy glue and turtle eggs",2769.55,"","184505852018","Isaiah O'Toole Edwards",""
"000000000254",5,1,"Load","flash-frozen french fries",5561.97,"751084212156","402421103978","Harriet B. Kern",""
"000000000254",5,2,"Drop","Orange juice, radium, flash-frozen french fries and quilts",5173.28,"293742599211","215525271578","Danielle Nelson-Smith",""
"000000000254",6,1,"Unload","Yoyos, uranium, nylon stockings and flash-frozen french fries",9897.74,"545914266989","","Patricia L. Harrison","Ulysses V. Kern"
"000000000254",8,1,"Load","Caesar salad mix",2934.01,"145327309572","526382394496","Oliver Ramakrishnan",""
"000000000254",9,1,"Hook","Bricks and flash-frozen french fries",4218.47,"17823646828","","Xaviera J. Williams",""
"000000000254",9,2,"Drop","Ice cream cones, windows, flash-frozen french fries and gold",8022.17,"237931391084","555537656227","Quincy G. Benitez",""
"000000000254",10,1,"Load","Caesar salad mix and jogging pants",3797.26,"","399171023912","Ulysses Yarbrough",""
"000000000254",11,1,"Drop","Velvet and uranium",9077.06,"336102774897","66380165316","Ulysses J. O'Toole",""
"000000000254",12,1,"Hook","yoyos",7464.17,"597983369353","","Roberta Perry",""
"000000000254",12,2,"Unload","Gold, dogfood, x-ray machine parts and quilts",7546.48,"","","Betty C. Anderson",""
"000000000254",13,1,"Load","apples",5603.43,"","62018311796","Nancy Mitchell-Williams","Mitchell Smith"
"000000000254",14,1,"Unload","Uranium and engine parts",3103.6,"362966193101","","Mitchell B. French Lewis",""
"000000000255",2,1,"Hook","Nylon stockings and bricks",9771.83,"120777988172","867381095562","Alfred P. Xing",""
"000000000255",3,1,"Hook","Orange juice, hot dog buns, nylon stockings and dogfood",7514.48,"904289490156","","Quincy H. Underwood-Anderson",""
"000000000255",4,1,"Load","uranium",6650.91,"","940995586614","Francis Underwood",""
"000000000255",6,1,"Hook","potatoes",6495.48,"158786937772","869309644690","Nancy Covington",""
"000000000255",6,2,"Unload","Caesar salad mix",7642.23,"513326171952","455305443374","Patricia Grimes",""
"000000000255",7,1,"Load","Gold, velvet and potatoes",9981.43,"287319554652","","Charles Underwood",""
"000000000255",7,2,"Unload","Orange juice, flash-frozen french fries, radium and engine parts",5418.76,"253566486236","","Nancy Kern",""
"000000000255",8,1,"Unload","Jogging pants and windows",8496.16,"","952111368204","Oliver T. Ramakrishnan-Thompson",""
"000000000256",2,1,"Hook","Velvet, jogging pants and hot dog buns",8813.2,"618046247118","","Mitchell P. Irvin",""
"000000000256",3,1,"Hook","Turtle eggs, orange juice and nylon stockings",8650.66,"","600221279192","George Velazquez",""
"000000000256",3,2,"Drop","yoyos",1446.89,"731578389141","","Kevin Ramakrishnan",""
"000000000256",4,1,"Hook","Potatoes and orange juice",9308.31,"","252801538242","Tammy Thompson-Irvin","Patricia I. Ramakrishnan Mitchell"
"000000000256",4,2,"Unload","Flash-frozen french fries, nylon stockings, gold and dogfood",3306.69,"","","Eduardo Thompson",""
"000000000256",5,1,"Load","Dogfood, turtle eggs and potatoes",1743,"","","Mitchell Quasnoy Lewis",""
"000000000256",5,2,"Unload","ice cream cones",6451.11,"947764973960","","Tammy O. Xing-Harrison","Danielle Anderson"
"000000000256",6,1,"Load","Windows and velvet",6092.94,"291139782841","865369891745","Eduardo Covington",""
"000000000256",7,1,"Drop","Quilts, Caesar salad mix and flash-frozen french fries",9966.12,"903941601388","325796060894","Ulysses J. French",""
"000000000257",2,1,"Load","gold",7965.36,"263598364295","229300163090","Betty T. Kern-Lewis",""
"000000000257",3,1,"Load","Orange juice, yoyos and velvet",5744.84,"450479209669","802362042252","Yancey U. Anderson",""
"000000000257",4,1,"Hook","Bricks and uranium",7466.94,"","","Xaviera Xing",""
"000000000257",4,2,"Drop","Machinery and ice cream cones",3781.89,"","231893025633","Tammy Q. Underwood",""
"000000000257",5,1,"Load","Yoyos, stovepipe hats and potatoes",5793.95,"538840006998","211239052973","Louise Edwards",""
"000000000257",6,1,"Unload","Velvet, x-ray machine parts and turtle eggs",3604.05,"","308493007498","Francis S. Harrison","Ulysses Quasnoy"
"000000000257",7,1,"Load","Yoyos, hot dog buns and ice cream cones",4250.49,"477236135071","287592842146","Eduardo H. Thompson-French",""
"000000000257",7,2,"Drop","Flash-frozen french fries and jogging pants",3463.4,"","347454129950","Janice Williams",""
"000000000257",8,1,"Unload","Dogfood, machinery and velvet",7186.79,"448585014725","","Patricia Irvin-Harrison","Kevin Ramakrishnan Xing"
"000000000257",9,1,"Unload","Quilts and gold",4836.82,"70257644681","","Kevin Underwood",""
"000000000257",10,1,"Unload","Dogfood and uranium",9952.24,"","745789502153","Louise O'Toole","Mitchell Anderson"
"000000000258",2,1,"Load","Potatoes, gold and stovepipe hats",1643.08,"","841766420616","Charles Ramakrishnan",""
"000000000258",5,1,"Hook","Potatoes, Caesar salad mix, uranium and x-ray machine parts",4666.06,"","698282601818","Alfred I. Thompson",""
"000000000258",5,2,"Drop","Apples, stovepipe hats and orange juice",8609.07,"128321066944","410358287106","Mitchell N. French-Grimes",""
"000000000258",8,1,"Hook","uranium",5303.62,"","","Harriet Ramakrishnan O'Toole",""
"000000000258",9,1,"Unload","flash-frozen french fries",7124.21,"293108012892","816082814891","Danielle C. Williams",""
"000000000259",2,1,"Load","Nylon stockings, apples and dogfood",5975.33,"","667993063032","Mitchell Williams","Danielle O. Nelson"
"000000000259",5,1,"Unload","dogfood",7603.74,"","75707706938","Alfred Benitez",""
"000000000260",2,1,"Load","machinery",6432.4,"","524412909558","Betty P. Smith",""
"000000000260",3,1,"Hook","Krazy glue, Caesar salad mix and machinery",3502.16,"102859638683","115384496635","Isaiah E. Mitchell-Williams","Alfred Covington"
"000000000260",3,2,"Drop","Ice cream cones and machinery",4721.32,"","327087133675","Francis X. Thompson",""
"000000000260",4,1,"Hook","Quilts, apples and flash-frozen french fries",7408.07,"","464033335781","Samuel Williams Anderson",""
"000000000260",4,2,"Unload","Yoyos and ice cream cones",6237.9,"299716269956","962176721892","William T. Underwood-Dawson",""
"000000000260",5,1,"Drop","radium",6493.76,"546772643839","","Samuel M. Underwood Edwards","Louise Jackson"
"000000000260",7,1,"Drop","Apples and jogging pants",6379.83,"160722708513","80571714311","Tammy C. Lewis",""
"000000000260",9,1,"Hook","Potatoes, apples and jogging pants",6451.31,"","","Charles D. Mitchell","Alfred Grimes"
"000000000260",10,1,"Load","Radium, uranium, turtle eggs and apples",6550.9,"459705860141","255444708019","Charles Irvin",""
"000000000260",10,2,"Drop","Caesar salad mix, machinery, stovepipe hats and gold",9093.92,"","621864367275","Alfred Ramakrishnan-Irvin",""
"000000000260",11,1,"Hook","stovepipe hats",1003.93,"386030999237","714813396403","Mitchell P. Xing-Benitez",""
"000000000260",12,1,"Load","Machinery, krazy glue and windows",7630.15,"","28509676070","Eduardo Q. Jackson Benitez",""
"000000000260",14,1,"Load","stovepipe hats",6207.31,"388137843478","","Isaiah X. Covington",""
"000000000260",15,1,"Drop","Apples, dogfood and quilts",456.54,"408121373776","178616757571","Francis Y. Covington","Betty Perry-Ramakrishnan"
"000000000261",2,1,"Load","nylon stockings",5655.73,"70333861179","","Nancy Thompson-Irvin","Oliver R. Thompson"
"000000000261",3,1,"Unload","krazy glue",1735.11,"","703101063589","Isaiah C. Perry",""
"000000000261",4,1,"Hook","Quilts, hot dog buns and lobsters",8255.66,"","802377152082","Quincy Irvin Velazquez","Danielle Harrison"
"000000000261",4,2,"Unload","Yoyos and dogfood",6507.64,"844929236808","","Louise Thompson",""
"000000000261",5,1,"Load","X-ray machine parts, hot dog buns, Caesar salad mix and stovepipe hats",9588.36,"597309884023","993336207808","Louise Perry",""
"000000000261",5,2,"Unload","Potatoes, bricks and x-ray machine parts",5240.4,"944843039117","268213292114","Ulysses E. Xing",""
"000000000261",6,1,"Load","Machinery, gold, orange juice and potatoes",7298.85,"795726996347","178047135677","Samuel V. Velazquez",""
"000000000261",6,2,"Unload","stovepipe hats",7774.06,"850404010723","","Patricia Velazquez",""
"000000000261",7,1,"Hook","Bricks, windows and uranium",3835.87,"566856514139","","Eduardo M. Yarbrough",""
"000000000261",7,2,"Unload","Ice cream cones and dogfood",4088.37,"","272420987618","Alfred Nelson-Harrison","Ulysses A. Underwood"
"000000000261",8,1,"Load","Turtle eggs, bricks, jogging pants and orange juice",3777.27,"","683583821235","Isaiah R. Smith",""
"000000000261",8,2,"Unload","orange juice",4379.87,"140733392967","320766519503","Isaiah Ramakrishnan-French",""
"000000000261",9,1,"Drop","Quilts and lobsters",1926.37,"388720878596","502901240622","Danielle Smith",""
"000000000262",2,1,"Load","Flash-frozen french fries, jogging pants, Caesar salad mix and quilts",5768.08,"911016494803","210509653745","Quincy Edwards",""
"000000000262",3,1,"Drop","Orange juice, potatoes and ice cream cones",6532.65,"720777469840","","Eduardo K. Edwards",""
"000000000262",4,1,"Drop","Bricks, apples, x-ray machine parts and radium",5564.71,"482999984225","385359278471","Yancey Thompson",""
"000000000262",5,1,"Unload","Dogfood, orange juice and potatoes",5471.17,"565171931370","","William Irvin",""
"000000000262",6,1,"Drop","Flash-frozen french fries and x-ray machine parts",2409.05,"639279957814","409156521152","Francis Kern-Yarbrough",""
"000000000262",7,1,"Unload","Apples, lobsters and radium",4443.91,"221728244849","","Louise H. Grimes-Anderson","Alfred Lewis-Benitez"
"000000000262",8,1,"Unload","Velvet and radium",3062.87,"327140407430","687943818497","Alfred Dawson Grimes",""
"000000000263",2,1,"Load","Uranium, orange juice, stovepipe hats and jogging pants",5099.89,"","","Xaviera M. French",""
"000000000263",5,1,"Drop","Potatoes, engine parts, stovepipe hats and quilts",1400.39,"","7474070151","Harriet R. Jackson",""
"000000000263",6,1,"Drop","Radium, hot dog buns, ice cream cones and orange juice",1443.04,"","","Francis Benitez",""
"000000000264",2,1,"Load","Caesar salad mix, bricks and flash-frozen french fries",8575.47,"","372591425419","Patricia V. Covington",""
"000000000264",6,1,"Load","velvet",3723.6,"932220753317","","Roberta Mitchell","Mitchell Mitchell"
"000000000264",7,1,"Load","Gold, stovepipe hats and krazy glue",6165.07,"414938123570","451689365351","Patricia J. Quasnoy",""
"000000000264",9,1,"Drop","Nylon stockings and bricks",5899.43,"","","Charles Benitez",""
"000000000265",2,1,"Hook","Dogfood, stovepipe hats and yoyos",1799.66,"512364454771","683497747154","Tammy Smith",""
"000000000265",3,1,"Hook","flash-frozen french fries",7510.65,"","988397133050","Nancy Jackson",""
"000000000265",4,1,"Load","Flash-frozen french fries, bricks, engine parts and windows",8874.91,"","785896965491","William B. Lewis-Williams",""
"000000000265",4,2,"Unload","Nylon stockings, turtle eggs and engine parts",1326.11,"","","Tammy Smith",""
"000000000265",5,1,"Load","quilts",5448.25,"","474898971101","George U. Underwood",""
"000000000265",6,1,"Unload","turtle eggs",658.27,"551068123659","","Patricia Irvin",""
"000000000265",8,1,"Load","Jogging pants and radium",4845.79,"","253893873952","George J. Nelson",""
"000000000265",9,1,"Hook","X-ray machine parts, gold and flash-frozen french fries",8235.18,"339077003950","117150212215","Harriet Dawson",""
"000000000265",9,2,"Drop","velvet",1760.29,"638321145826","","Quincy Kern",""
"000000000265",10,1,"Drop","Gold, lobsters, dogfood and windows",6302.09,"","428088095095","Danielle B. French-Harrison",""
"000000000265",12,1,"Hook","Yoyos, velvet and stovepipe hats",2770.8,"627687730610","","Isaiah Ramakrishnan-Harrison",""
"000000000265",13,1,"Drop","Hot dog buns, uranium and windows",1840.64,"","138518260578","Harriet Kern",""
"000000000266",2,1,"Load","Gold, radium and apples",7542.88,"712099374075","418649945875","George H. Covington",""
"000000000266",3,1,"Unload","Jogging pants, orange juice and bricks",8950.86,"560093990849","609937690598","Kevin S. Nelson",""
"000000000266",4,1,"Drop","x-ray machine parts",2357.92,"306862584067","","George Benitez",""
"000000000266",5,1,"Unload","Bricks, Caesar salad mix, hot dog buns and orange juice",8623.93,"632600312498","877687169863","Francis Yarbrough",""
"000000000266",6,1,"Hook","Krazy glue, bricks, dogfood and potatoes",3020.77,"","190201464658","Velma Jackson",""
"000000000266",7,1,"Drop","Apples, jogging pants, lobsters and Caesar salad mix",9557.28,"495867039877","853382514325","William Lewis",""
"000000000267",2,1,"Load","Flash-frozen french fries and uranium",1472.23,"634018083901","","Quincy Yarbrough Underwood",""
"000000000267",3,1,"Drop","Krazy glue, quilts, potatoes and stovepipe hats",8590.33,"785881293931","217169854867","Roberta D. Jackson",""
"000000000267",4,1,"Hook","machinery",948.1,"814896178838","938058666589","Samuel Nelson","Oliver E. Kern"
"000000000267",6,1,"Drop","yoyos",601.82,"531453770895","560232994780","Tammy Mitchell",""
"000000000267",7,1,"Hook","radium",4349.13,"135149035081","987181224794","Betty French",""
"000000000267",7,2,"Unload","Potatoes and ice cream cones",3125.51,"677724513099","938133506065","Samuel X. Williams",""
"000000000267",8,1,"Load","flash-frozen french fries",9234.09,"","","Quincy Nelson",""
"000000000267",8,2,"Unload","Caesar salad mix, dogfood, jogging pants and potatoes",5775.58,"676200027949","618356732008","Quincy Williams",""
"000000000267",9,1,"Drop","Krazy glue, nylon stockings and bricks",7390.33,"245960616683","39981258748","Isaiah Xing",""
"000000000267",10,1,"Hook","Jogging pants and krazy glue",8604.91,"","","Xaviera Y. Velazquez Williams","Velma W. Lewis"
"000000000267",10,2,"Unload","Potatoes, apples, quilts and yoyos",257.27,"867025610058","701645531179","Roberta Lewis","Charles E. Velazquez-Dawson"
"000000000267",11,1,"Unload","Radium and nylon stockings",5861.05,"","676097050398","Nancy B. Benitez",""
"000000000268",2,1,"Hook","Apples and potatoes",8366.33,"","861407912954","William Thompson","Quincy Grimes"
"000000000268",3,1,"Hook","Lobsters, radium, engine parts and hot dog buns",9460.23,"","342370436352","Ulysses Jackson",""
"000000000268",3,2,"Drop","Caesar salad mix, potatoes, radium and turtle eggs",7867.5,"","609105013850","Nancy I. Ramakrishnan",""
"000000000268",4,1,"Drop","stovepipe hats",9261.31,"137498388950","","Charles S. Benitez",""
"000000000268",8,1,"Unload","Jogging pants, lobsters, ice cream cones and quilts",7581.09,"","70315674593","Tammy S. Kern",""
"000000000268",10,1,"Drop","krazy glue",3514.88,"377109468974","840834124074","Velma O'Toole",""
"000000000269",2,1,"Hook","Flash-frozen french fries, dogfood, windows and bricks",5253.76,"30742407363","960405791627","Mitchell Lewis",""
"000000000269",4,1,"Drop","Radium and gold",8872.49,"886284502597","","Betty Dawson",""
"000000000270",2,1,"Load","ice cream cones",9780.36,"","85182425134","Patricia I. Kern",""
"000000000270",3,1,"Unload","Flash-frozen french fries, nylon stockings and potatoes",7982.2,"434891653193","","Charles B. Mitchell",""
"000000000270",4,1,"Drop","Windows and yoyos",6586.34,"","196589677126","Samuel Dawson",""
"000000000270",5,1,"Load","radium",3586.67,"","724009504050","George F. O'Toole",""
"000000000270",5,2,"Drop","Velvet, potatoes, quilts and jogging pants",1696.44,"","544021065111","Velma Harrison","Francis P. Lewis"
"000000000270",6,1,"Load","uranium",1052.09,"24592272527","744970871648","Quincy G. Anderson",""
"000000000270",6,2,"Drop","Radium, jogging pants, yoyos and bricks",2701.87,"","538017236697","Francis B. Nelson",""
"000000000270",7,1,"Load","Orange juice and turtle eggs",9141.56,"961433320840","453351951884","Roberta P. Thompson","George S. Smith"
"000000000270",8,1,"Unload","stovepipe hats",1462.43,"","594357959167","Isaiah Thompson",""
"000000000271",2,1,"Load","Quilts, stovepipe hats, engine parts and Caesar salad mix",3812.42,"62110991108","238214487667","Yancey Thompson",""
"000000000271",3,1,"Hook","dogfood",6349.22,"","249729197560","Harriet R. Thompson-Anderson",""
"000000000271",4,1,"Unload","apples",1104.58,"913589179453","","Xaviera N. Harrison","Xaviera Smith Quasnoy"
"000000000271",6,1,"Load","nylon stockings",4792.67,"433754861769","","Nancy B. Lewis","Betty Benitez"
"000000000271",6,2,"Unload","Dogfood, lobsters and bricks",4035.63,"","","Tammy D. Benitez",""
"000000000271",7,1,"Load","Machinery, potatoes, gold and engine parts",7858.92,"199436154103","373434205349","Janice C. Mitchell Underwood",""
"000000000271",8,1,"Hook","nylon stockings",1061.6,"84514105295","666382160644","Eduardo L. Harrison",""
"000000000271",9,1,"Load","jogging pants",9443.74,"434747956200","283774633706","Alfred L. Benitez","Charles Irvin"
"000000000271",11,1,"Unload","Jogging pants, potatoes and engine parts",4589.39,"248456004834","","Mitchell X. Jackson",""
"000000000271",12,1,"Unload","hot dog buns",227.9,"682625596796","","Louise Ramakrishnan",""
"000000000271",14,1,"Unload","windows",2598.79,"727605821051","","Tammy Covington Benitez",""
"000000000272",2,1,"Hook","Yoyos, nylon stockings, velvet and jogging pants",6395.07,"61746650066","381116507267","William G. French",""
"000000000272",3,1,"Unload","orange juice",5390.39,"","162799962639","Francis Harrison",""
"000000000272",4,1,"Hook","Windows, engine parts, hot dog buns and stovepipe hats",6195.58,"229897826358","540192817414","Kevin Benitez",""
"000000000272",4,2,"Drop","turtle eggs",1692.61,"896828753593","","Mitchell Kern",""
"000000000272",5,1,"Drop","Ice cream cones and nylon stockings",809.51,"391889931101","610544509333","Roberta P. Anderson-Dawson",""
"000000000272",6,1,"Drop","orange juice",1363.9,"","","Roberta French",""
"000000000272",7,1,"Drop","Hot dog buns and Caesar salad mix",3220.71,"278725092665","63534868595","William Covington",""
"000000000272",8,1,"Drop","Velvet, engine parts and machinery",8685.83,"153955983479","488959099761","Yancey Thompson-Lewis",""
"000000000272",9,1,"Unload","Radium, windows and lobsters",647.65,"646808415634","","Oliver H. Yarbrough",""
"000000000273",2,1,"Hook","Nylon stockings and x-ray machine parts",889.68,"6211820024","","Yancey R. Perry",""
"000000000273",3,1,"Hook","Windows and apples",9316.53,"875682010882","40225057456","Xaviera A. Thompson-Jackson",""
"000000000273",3,2,"Drop","gold",5912.59,"","589182368851","Samuel V. Mitchell",""
"000000000273",4,1,"Load","Ice cream cones, x-ray machine parts, radium and krazy glue",3906.97,"911089265976","550638496953","Eduardo Covington-Benitez",""
"000000000273",4,2,"Unload","Machinery, Caesar salad mix and lobsters",7233.52,"930742087586","932563540711","Nancy Anderson",""
"000000000273",6,1,"Load","Potatoes and windows",1161.94,"","641995573226","Francis Harrison","Danielle Anderson"
"000000000273",6,2,"Drop","Flash-frozen french fries, ice cream cones and dogfood",313.58,"","224875161270","Yancey Ramakrishnan",""
"000000000273",7,1,"Hook","radium",6215.85,"717105581428","229035353260","Quincy P. Thompson",""
"000000000273",7,2,"Unload","nylon stockings",6299.99,"","353769049176","Patricia Irvin-Ramakrishnan",""
"000000000273",8,1,"Unload","Machinery, bricks and krazy glue",6955.58,"","809263959900","Louise E. Covington",""
"000000000273",9,1,"Unload","Hot dog buns, apples and stovepipe hats",8664.79,"","607171126194","Harriet C. Smith",""
"000000000274",2,1,"Hook","Dogfood and machinery",6162.57,"","147293742990","Quincy French",""
"000000000274",3,1,"Hook","flash-frozen french fries",3503.97,"","72761854046","Patricia Williams",""
"000000000274",4,1,"Hook","Krazy glue, gold and engine parts",3267.63,"","692978868423","Kevin H. Yarbrough","Roberta U. Anderson"
"000000000274",5,1,"Drop","Dogfood and hot dog buns",5269.52,"","","Ulysses V. Dawson",""
"000000000275",2,1,"Hook","Yoyos, velvet and potatoes",9891.42,"","433181408742","Danielle O'Toole Smith",""
"000000000275",6,1,"Load","yoyos",9766.97,"344637083122","667035456388","Yancey Velazquez",""
"000000000275",8,1,"Hook","gold",748.63,"883205638546","8700369602","Isaiah P. Grimes",""
"000000000275",8,2,"Drop","X-ray machine parts, jogging pants, velvet and ice cream cones",8880.64,"563048957429","412474701607","Samuel Covington",""
"000000000275",9,1,"Load","Krazy glue, orange juice and potatoes",4307.12,"","674495138692","Kevin E. Williams",""
"000000000275",9,2,"Unload","x-ray machine parts",9646.7,"","191204906429","Alfred Velazquez",""
"000000000275",11,1,"Hook","Stovepipe hats, Caesar salad mix and flash-frozen french fries",7331.67,"","539196761969","Nancy Jackson",""
"000000000275",11,2,"Drop","Stovepipe hats, machinery, gold and dogfood",1032.56,"","420597088316","Ulysses Williams-Dawson",""
"000000000275",12,1,"Unload","windows",9151.92,"581451802127","","Ulysses Mitchell",""
"000000000276",2,1,"Hook","bricks",5825.93,"534782125225","608553895594","Eduardo Lewis",""
"000000000276",4,1,"Unload","Caesar salad mix and machinery",7796.54,"","","Danielle Smith",""
"000000000276",5,1,"Load","orange juice",4345.09,"","","Patricia Edwards",""
"000000000276",5,2,"Drop","Dogfood and gold",4940.48,"250819273824","628447905639","George A. French",""
"000000000276",6,1,"Load","Apples, yoyos, lobsters and turtle eggs",9947.54,"645462555647","999886203007","Kevin Thompson",""
"000000000276",6,2,"Drop","stovepipe hats",1999.67,"","323287205561","Roberta Jackson",""
"000000000276",7,1,"Hook","Bricks, orange juice and krazy glue",8336.61,"791538915367","223083674030","Quincy J. Harrison","Nancy O'Toole"
"000000000276",8,1,"Hook","Uranium, x-ray machine parts and lobsters",4991.89,"","","Charles U. Jackson",""
"000000000276",9,1,"Load","radium",3504.86,"446174034279","","Oliver Yarbrough",""
"000000000276",10,1,"Unload","Velvet, stovepipe hats and turtle eggs",7952.82,"","","Eduardo Thompson",""
"000000000277",2,1,"Hook","X-ray machine parts, turtle eggs, apples and yoyos",5075.4,"","592423126983","Francis T. Ramakrishnan",""
"000000000277",5,1,"Unload","Dogfood and machinery",6656.64,"303214526355","","Louise Benitez-Dawson",""
