OrderId,StopSequenceNumber,CargoChangeSequenceNumber,CargoChangeType,GeneralDescription,Weight,TruckNumber,TrailerNumber,Driver1Name,Driver2Name
"000000000131",5,1,"Hook","Lobsters, jogging pants, uranium and radium",6486.59,"","852018576388","Kevin L. Williams",""
"000000000131",6,1,"Unload","Jogging pants, uranium and bricks",1998.48,"56519689285","195198509284","Ulysses Harrison",""
"000000000132",2,1,"Load","Jogging pants, yoyos and uranium",9686.66,"","","Tammy Dawson-Grimes",""
"000000000132",6,1,"Unload","Ice cream cones, potatoes and dogfood",4919.1,"576730254786","271143245132","Louise H. Edwards",""
"000000000133",2,1,"Hook","Stovepipe hats, flash-frozen french fries and machinery",437.08,"","","Louise Y. Benitez",""
"000000000133",4,1,"Load","quilts",3684.06,"","726314683903","Ulysses Perry","Tammy H. Edwards-Benitez"
"000000000133",4,2,"Unload","Flash-frozen french fries and jogging pants",7757.43,"334736450382","","Kevin Lewis",""
"000000000133",5,1,"Unload","Turtle eggs, jogging pants and ice cream cones",8508.1,"","781648813430","Oliver O'Toole",""
"000000000134",2,1,"Load","Stovepipe hats, krazy glue and radium",3569.07,"127764263082","","Mitchell O'Toole","Yancey N. Perry"
"000000000134",3,1,"Load","engine parts",925.24,"","","Yancey Velazquez",""
"000000000134",4,1,"Hook","Windows, lobsters and yoyos",3021.6,"416637983806","679486087940","Patricia J. Anderson",""
"000000000134",5,1,"Load","quilts",558.87,"46871558581","759511984895","Betty Williams",""
"000000000134",6,1,"Hook","Radium and flash-frozen french fries",8055.93,"298178435735","","Alfred Jackson Mitchell",""
"000000000134",7,1,"Load","Engine parts, x-ray machine parts, bricks and gold",1877.73,"","437367127356","William X. Smith",""
"000000000134",8,1,"Drop","Engine parts and bricks",5395.25,"690093197253","479270901762","Alfred Lewis",""
"000000000135",2,1,"Load","Stovepipe hats, flash-frozen french fries and bricks",4698.48,"903492587863","440682980840","Kevin S. Edwards","Janice V. Mitchell"
"000000000135",3,1,"Load","hot dog buns",2919.7,"","","Eduardo B. Underwood",""
"000000000135",5,1,"Drop","Uranium and x-ray machine parts",3110.06,"","836284319848","Quincy Kern-Thompson",""
"000000000135",8,1,"Hook","Quilts, windows, dogfood and turtle eggs",3541.07,"963356087447","853611866720","Samuel Underwood",""
"000000000135",8,2,"Unload","Krazy glue and radium",3024.79,"289634467826","882653652182","Xaviera Benitez",""
"000000000135",9,1,"Load","Machinery, orange juice and jogging pants",712.65,"","497894288454","George Thompson",""
"000000000135",9,2,"Drop","yoyos",5176.07,"151433705544","510171782861","Charles K. French","George Ramakrishnan"
"000000000135",10,1,"Load","radium",7839,"","948347182735","Samuel P. Jackson",""
"000000000135",10,2,"Drop","Apples, gold and orange juice",3115.23,"725144750565","866112196103","Nancy K. Grimes",""
"000000000135",12,1,"Hook","Flash-frozen french fries and ice cream cones",3789.59,"","","Ulysses Yarbrough Covington",""
"000000000135",12,2,"Drop","Potatoes, x-ray machine parts, quilts and lobsters",694.11,"423193565356","748092748427","Isaiah Lewis","Yancey K. Mitchell-Edwards"
"000000000135",13,1,"Drop","Engine parts, machinery and ice cream cones",472.09,"908202029140","","Patricia O'Toole-Ramakrishnan",""
"000000000136",2,1,"Hook","Caesar salad mix",1285.17,"489274313852","","William Ramakrishnan","Mitchell Anderson"
"000000000136",3,1,"Unload","Machinery, potatoes and yoyos",1013.96,"397227077969","475069206036","Mitchell Jackson",""
"000000000136",4,1,"Hook","turtle eggs",1816.31,"","","Louise M. Williams","Velma Y. Williams Jackson"
"000000000136",4,2,"Drop","Dogfood, apples, quilts and gold",9056.87,"805330336851","106402295358","Yancey Lewis",""
"000000000136",5,1,"Load","Quilts, uranium and machinery",4993.65,"623650298039","","Samuel N. Irvin",""
"000000000136",5,2,"Drop","Bricks, engine parts and quilts",9260.25,"54068797932","597764706304","Kevin X. Jackson",""
"000000000136",6,1,"Load","Machinery and jogging pants",5028.35,"653908206781","","Nancy Lewis",""
"000000000136",6,2,"Drop","ice cream cones",8229.99,"1451782587","227596706151","Patricia T. Irvin",""
"000000000136",7,1,"Drop","nylon stockings",7169.93,"310598711294","597414362252","Patricia I. Nelson","Mitchell Benitez"
"000000000136",8,1,"Drop","Krazy glue and jogging pants",1342.61,"994177863551","144616362765","Eduardo Covington","Alfred Smith"
"000000000136",9,1,"Drop","Dogfood, radium, velvet and machinery",8775.53,"697740728615","","Nancy G. Anderson",""
"000000000137",2,1,"Hook","engine parts",4448.04,"","","Roberta C. Perry","Roberta T. Ramakrishnan-Kern"
"000000000137",3,1,"Hook","Radium, machinery and yoyos",5623.01,"953133291085","735704755681","Roberta Grimes",""
"000000000137",5,1,"Unload","Potatoes and lobsters",5824.1,"218114185733","279352306501","Kevin French",""
"000000000138",2,1,"Load","Krazy glue, radium, flash-frozen french fries and ice cream cones",6846.54,"658318542555","","Francis Edwards",""
"000000000138",3,1,"Drop","x-ray machine parts",4956.53,"226210624515","604740342047","Oliver G. Xing",""
"000000000138",4,1,"Drop","Stovepipe hats, nylon stockings, Caesar salad mix and yoyos",4718.18,"","","Patricia O. Jackson","Tammy Benitez"
"000000000138",5,1,"Hook","Quilts, potatoes, apples and ice cream cones",8730.61,"937035659857","","Francis Harrison",""
"000000000138",6,1,"Unload","Windows and x-ray machine parts",7996.65,"9454883787","511193245089","George French","Tammy French Dawson"
"000000000139",2,1,"Load","Lobsters, orange juice and potatoes",327.75,"795211555317","","Quincy N. Kern O'Toole",""
"000000000139",3,1,"Hook","apples",1334.41,"474188786779","545897397157","Janice Yarbrough-French",""
"000000000139",4,1,"Unload","Hot dog buns, radium and krazy glue",2964.32,"","165177441597","Charles I. French",""
"000000000139",5,1,"Hook","Gold and bricks",1848.21,"37378756460","","William S. Smith",""
"000000000139",6,1,"Unload","Nylon stockings, gold, krazy glue and potatoes",1498.25,"","827121251334","Eduardo Ramakrishnan","Yancey French"
"000000000139",7,1,"Drop","Apples and bricks",3227.49,"","","Alfred Perry-Smith",""
"000000000139",8,1,"Drop","Dogfood and gold",8731.35,"162888189548","739288104436","Alfred Xing",""
"000000000139",9,1,"Drop","Lobsters, uranium, machinery and ice cream cones",9667.09,"","","George Smith",""
"000000000140",2,1,"Hook","Nylon stockings and bricks",7712.84,"","759906158704","Patricia Y. Ramakrishnan",""
"000000000140",4,1,"Load","Velvet, lobsters, jogging pants and ice cream cones",4422.8,"981445644902","405855078094","Mitchell Kern",""
"000000000140",4,2,"Unload","Velvet and nylon stockings",4606.16,"548598224788","","Harriet Kern",""
"000000000140",5,1,"Unload","turtle eggs",3448.29,"747514625577","956739590272","Velma Harrison",""
"000000000141",2,1,"Hook","Yoyos and lobsters",3370.56,"","861687415505","Francis Underwood",""
"000000000141",3,1,"Hook","Flash-frozen french fries and apples",7361.63,"999403943070","109563026218","Xaviera K. French","Ulysses Williams"
"000000000141",5,1,"Hook","Machinery, jogging pants, engine parts and orange juice",7023.46,"104058650372","806388853342","Oliver R. Irvin-Ramakrishnan",""
"000000000141",6,1,"Load","Apples and turtle eggs",7454.34,"","715104254357","Velma X. Anderson","Tammy Benitez"
"000000000141",7,1,"Load","Dogfood and stovepipe hats",7909.14,"238466644079","307798156904","Roberta X. Grimes-Edwards",""
"000000000141",8,1,"Hook","Orange juice and windows",2742.84,"","450797862442","Mitchell Lewis",""
"000000000141",9,1,"Unload","Windows and potatoes",5774.97,"","941607735030","William Ramakrishnan-Mitchell",""
"000000000142",2,1,"Hook","Machinery, lobsters, turtle eggs and hot dog buns",5459.76,"","175029980203","Charles Thompson",""
"000000000142",3,1,"Unload","Uranium and ice cream cones",3653.36,"","14128668456","Harriet U. Mitchell",""
"000000000142",4,1,"Drop","Gold, engine parts and yoyos",720.38,"","907597826626","Betty Ramakrishnan Yarbrough",""
"000000000142",5,1,"Unload","Nylon stockings and uranium",7146.65,"749488635945","","Janice Smith",""
"000000000142",6,1,"Load","machinery",7774.32,"","","Danielle Anderson",""
"000000000142",6,2,"Drop","Lobsters, hot dog buns and windows",9926.67,"","","Betty Grimes","Janice O. Mitchell-Perry"
"000000000142",7,1,"Load","Flash-frozen french fries and velvet",9977.08,"","846862983944","Danielle Lewis Jackson",""
"000000000142",8,1,"Load","uranium",1046.52,"","330839998253","Xaviera B. Underwood",""
"000000000142",8,2,"Unload","apples",6081.26,"29127768656","783338604202","Louise Y. Velazquez Jackson",""
"000000000142",9,1,"Drop","Lobsters, uranium and windows",8430.89,"699373504201","621421566257","Oliver X. Williams","Roberta Irvin"
"000000000142",10,1,"Load","Dogfood and ice cream cones",1140.31,"151556010542","","Ulysses Thompson",""
"000000000142",10,2,"Drop","Yoyos, flash-frozen french fries and radium",8011.19,"","222048351620","Samuel O. Underwood",""
"000000000142",11,1,"Drop","Quilts, dogfood and apples",3325.77,"806482226098","","Mitchell S. Anderson French",""
"000000000143",2,1,"Load","Turtle eggs, engine parts, radium and stovepipe hats",6278.56,"147345426615","982458563601","Nancy P. Quasnoy",""
"000000000143",3,1,"Hook","Dogfood and stovepipe hats",6062.42,"","","Xaviera Nelson","Ulysses Velazquez-Williams"
"000000000143",4,1,"Hook","bricks",6401.05,"181472987787","","Janice Williams-Smith",""
"000000000143",5,1,"Drop","Ice cream cones, windows, quilts and bricks",5214.16,"","","Isaiah Quasnoy",""
"000000000143",6,1,"Hook","velvet",9267.58,"","924871877855","Alfred K. Irvin","Charles Ramakrishnan Underwood"
"000000000143",7,1,"Load","Ice cream cones and machinery",2704.34,"261621608059","830344527626","Francis U. Lewis",""
"000000000143",8,1,"Drop","Dogfood, hot dog buns and gold",3876.19,"","87846874606","Alfred U. Williams",""
"000000000143",10,1,"Load","orange juice",5998.89,"472043154235","536380796177","Louise French",""
"000000000143",12,1,"Unload","Hot dog buns, ice cream cones and orange juice",6716.51,"985859002740","366125104843","Velma Benitez",""
"000000000143",13,1,"Drop","Quilts and flash-frozen french fries",7032.24,"174286309162","","Velma Jackson",""
"000000000143",16,1,"Drop","Flash-frozen french fries, bricks and dogfood",8735.83,"738116611332","","Quincy J. Underwood",""
"000000000144",2,1,"Hook","Dogfood, ice cream cones and orange juice",7080.52,"825069966416","20432082743","Betty Covington",""
"000000000144",3,1,"Unload","Caesar salad mix, uranium and radium",7816.11,"","207954813546","Francis J. O'Toole",""
"000000000145",2,1,"Load","Jogging pants and orange juice",5654.06,"122162882148","","George F. Anderson",""
"000000000145",3,1,"Load","engine parts",722.76,"686529897553","","George V. Yarbrough","Ulysses W. Nelson"
"000000000145",3,2,"Unload","Lobsters, quilts, engine parts and orange juice",2479.83,"690646655777","","Yancey Harrison",""
"000000000145",4,1,"Unload","Stovepipe hats, lobsters, flash-frozen french fries and hot dog buns",5055.65,"294190728508","8087449039","Tammy G. Anderson",""
"000000000145",5,1,"Unload","radium",920.66,"158715488293","81926798167","Xaviera G. French-Lewis",""
"000000000145",6,1,"Unload","ice cream cones",3914.25,"","358350935876","Samuel Dawson",""
"000000000146",2,1,"Load","Windows, krazy glue, uranium and engine parts",7999.42,"227597658871","","Yancey Xing",""
"000000000146",3,1,"Unload","Potatoes and quilts",6433.24,"827939668111","881336482771","Roberta E. French-Irvin",""
"000000000146",4,1,"Unload","Turtle eggs and windows",7177.46,"","","William Xing",""
"000000000146",5,1,"Load","Quilts, yoyos, jogging pants and ice cream cones",9110.61,"707946081176","882208089989","Isaiah H. Underwood",""
"000000000146",6,1,"Hook","Krazy glue, bricks, jogging pants and quilts",9767.66,"36919785544","161438384141","George E. Jackson",""
"000000000146",7,1,"Unload","Radium and jogging pants",4794.99,"840462507024","74397177946","Xaviera Harrison",""
"000000000147",2,1,"Hook","Radium, orange juice and windows",4966.49,"284256898247","460872724772","Tammy Irvin",""
"000000000147",3,1,"Unload","Quilts, nylon stockings and yoyos",9445.62,"849267868848","822858865969","Velma French",""
"000000000147",4,1,"Hook","Hot dog buns, potatoes and quilts",5480.33,"419727339737","","Alfred Thompson",""
"000000000147",4,2,"Unload","Windows, orange juice, Caesar salad mix and radium",5541.85,"101205577678","2191225024","Yancey R. Anderson",""
"000000000147",5,1,"Unload","Uranium and ice cream cones",2730.22,"","163371623418","Charles L. Perry",""
"000000000147",6,1,"Drop","Jogging pants and nylon stockings",6517.41,"506532665959","455511344008","Harriet Irvin",""
"000000000147",7,1,"Load","Jogging pants and orange juice",7985.82,"803742212857","","Harriet M. Quasnoy",""
"000000000147",7,2,"Drop","Radium and flash-frozen french fries",1830.06,"785738833857","405933514483","Louise French",""
"000000000147",8,1,"Drop","flash-frozen french fries",555.55,"628183465674","93530190277","Ulysses Lewis",""
"000000000147",9,1,"Hook","Radium, nylon stockings, jogging pants and yoyos",5742.7,"","601615496660","Quincy Ramakrishnan",""
"000000000147",9,2,"Unload","Turtle eggs and machinery",2715.51,"336492846673","918932371071","Janice French-Dawson",""
"000000000147",10,1,"Unload","Windows, radium, x-ray machine parts and uranium",5709.34,"44835820599","789116735494","Xaviera L. Nelson",""
"000000000147",11,1,"Hook","Krazy glue, apples and ice cream cones",7034.49,"678634096751","652662618715","Alfred Dawson",""
"000000000147",11,2,"Unload","Uranium and bricks",1117.1,"","869592458176","Isaiah J. Jackson-Nelson",""
"000000000147",12,1,"Unload","Quilts, nylon stockings and ice cream cones",7342.86,"38998847478","562234674303","William Grimes",""
"000000000148",2,1,"Hook","uranium",8406.54,"","","Isaiah T. Underwood",""
"000000000148",6,1,"Load","Yoyos, potatoes, uranium and turtle eggs",4572.59,"712346154740","738530772291","Harriet Benitez-Edwards",""
"000000000148",6,2,"Unload","uranium",5175.27,"600215610379","","Nancy P. Covington",""
"000000000148",7,1,"Load","Stovepipe hats, lobsters and gold",5198.24,"954840429288","415387815364","Harriet Perry",""
"000000000148",8,1,"Hook","krazy glue",7901.95,"","256473699659","Oliver O'Toole",""
"000000000148",9,1,"Hook","Nylon stockings and jogging pants",1178.36,"238405444385","830545755781","Quincy D. Mitchell",""
"000000000148",9,2,"Drop","Flash-frozen french fries, quilts, gold and velvet",9490.31,"","619701412464","George Williams",""
"000000000148",10,1,"Load","lobsters",8888.42,"861139009772","256546677432","Xaviera Benitez",""
"000000000148",10,2,"Drop","yoyos",1585.38,"680276136995","","Yancey Covington",""
"000000000148",11,1,"Unload","Stovepipe hats and velvet",8893.57,"385073953967","349673198923","Oliver T. Nelson-Underwood",""
"000000000149",2,1,"Load","Nylon stockings, windows, lobsters and engine parts",8454.77,"","515364443547","Isaiah H. Underwood",""
"000000000149",3,1,"Unload","dogfood",943.95,"129755605529","","Tammy Williams-Perry","Isaiah S. Anderson"
"000000000149",4,1,"Hook","x-ray machine parts",4207.34,"386774647342","503402022311","Yancey Q. French-Anderson",""
"000000000149",5,1,"Drop","machinery",4330.37,"323056825558","453646908618","Eduardo Nelson French",""
"000000000149",6,1,"Drop","Windows and velvet",3804.24,"155743867236","544231445620","Francis Harrison-Grimes",""
"000000000149",8,1,"Unload","Apples, engine parts, velvet and x-ray machine parts",4423.39,"","","Velma Williams Anderson",""
"000000000150",2,1,"Load","Uranium, turtle eggs and yoyos",3559.69,"565573801328","68861808260","Yancey Underwood Nelson","Harriet V. Yarbrough"
"000000000150",3,1,"Load","potatoes",2825.98,"","","Charles R. Harrison Williams",""
"000000000150",3,2,"Unload","Radium, krazy glue and machinery",5699,"279827028668","533592554999","Patricia Harrison-Kern",""
"000000000150",4,1,"Load","X-ray machine parts and bricks",8204.29,"821182732273","476798176284","Betty G. Edwards",""
"000000000150",5,1,"Load","Quilts, gold, lobsters and bricks",593.76,"","","Charles R. Harrison",""
"000000000150",6,1,"Load","krazy glue",3941.62,"","753950573532","William J. Lewis",""
"000000000150",6,2,"Unload","Caesar salad mix, krazy glue and radium",8299.99,"132809208160","349304987434","Xaviera Irvin","Oliver Xing"
"000000000150",7,1,"Load","Gold, apples, orange juice and machinery",7537.91,"","401405690311","Charles French",""
"000000000150",7,2,"Drop","bricks",4520.72,"618944425982","416157873122","Nancy S. French",""
"000000000150",9,1,"Load","Engine parts, bricks, windows and hot dog buns",7205.77,"","5995644926","Yancey Lewis",""
"000000000150",9,2,"Unload","Apples, hot dog buns and bricks",6370.61,"537398369048","","Yancey C. Smith Grimes",""
"000000000150",10,1,"Unload","Hot dog buns, jogging pants, krazy glue and ice cream cones",5602.38,"136142992142","190834742154","Danielle T. Benitez",""
"000000000151",2,1,"Load","Quilts, hot dog buns, nylon stockings and ice cream cones",9832.37,"413776018884","411098928280","William Harrison",""
"000000000151",3,1,"Load","X-ray machine parts, hot dog buns, windows and lobsters",8579.69,"644108446162","","Eduardo Y. Yarbrough","Eduardo Y. Nelson"
"000000000151",3,2,"Unload","Windows, hot dog buns and x-ray machine parts",698.02,"444439218952","","Alfred P. Quasnoy",""
"000000000151",4,1,"Load","Orange juice, turtle eggs and windows",2209.44,"290852110308","71961393852","William X. Edwards",""
"000000000151",5,1,"Load","Krazy glue and gold",4148.8,"","","Ulysses D. Edwards",""
"000000000151",5,2,"Unload","Radium and x-ray machine parts",9678.75,"299827162000","374684341381","Louise Williams",""
"000000000151",6,1,"Load","Apples and turtle eggs",9323.89,"723433145411","746707308450","Patricia Irvin-French",""
"000000000151",6,2,"Drop","Stovepipe hats, potatoes and x-ray machine parts",2511.72,"959842191321","318146816680","Ulysses L. Benitez Kern",""
"000000000151",7,1,"Load","Hot dog buns and dogfood",9461.04,"985383775040","357247243041","Louise Mitchell",""
"000000000151",8,1,"Hook","Dogfood, krazy glue, potatoes and engine parts",8142.11,"145641328967","","Isaiah E. Harrison",""
"000000000151",9,1,"Load","Jogging pants, apples, nylon stockings and Caesar salad mix",2339.51,"","73815316633","Francis Dawson",""
"000000000151",9,2,"Drop","Turtle eggs, yoyos, nylon stockings and stovepipe hats",5991.05,"897799840537","275436222197","Kevin Xing-Anderson","Ulysses J. Underwood"
"000000000151",10,1,"Load","Ice cream cones and hot dog buns",2365.02,"452253461244","881811591501","Betty Kern-French",""
"000000000151",10,2,"Drop","Engine parts, nylon stockings and ice cream cones",2773.54,"361716346854","","Francis B. French",""
"000000000151",11,1,"Load","Quilts and orange juice",2804.89,"212817097750","209162956408","Ulysses N. O'Toole",""
"000000000151",12,1,"Drop","Radium and ice cream cones",6717.32,"862641707266","","Janice I. Yarbrough",""
"000000000152",2,1,"Load","Orange juice and yoyos",3013.75,"358226024916","","Janice M. French Quasnoy",""
"000000000152",4,1,"Hook","radium",3108.98,"659995282995","31180207428","Ulysses French",""
"000000000152",5,1,"Hook","Turtle eggs, bricks, machinery and radium",4439.19,"709776929193","","Yancey Ramakrishnan",""
"000000000152",6,1,"Hook","Machinery and stovepipe hats",8864.27,"","464639950050","Charles Q. Harrison",""
"000000000152",6,2,"Unload","apples",3929.99,"529566459055","","Isaiah V. Thompson","Harriet Q. Edwards"
"000000000152",7,1,"Load","Nylon stockings and windows",7397.81,"","819075793403","Quincy M. Jackson",""
"000000000152",8,1,"Load","Bricks, flash-frozen french fries and quilts",2140.14,"989400228232","","Danielle Velazquez",""
"000000000152",10,1,"Drop","stovepipe hats",6885.87,"336957977675","","Velma N. Covington",""
"000000000153",2,1,"Hook","Yoyos, velvet and lobsters",1080.71,"","932186953640","Ulysses H. Perry",""
"000000000153",3,1,"Drop","quilts",3482.37,"669111503446","786877041788","Harriet Y. Quasnoy",""
"000000000153",4,1,"Unload","radium",2834.68,"180908215920","226707420300","Kevin Velazquez",""
"000000000153",5,1,"Load","nylon stockings",5941.21,"","102743155029","Samuel L. Williams",""
"000000000153",6,1,"Drop","machinery",8501.06,"412111719704","274342415054","Oliver Lewis",""
"000000000153",7,1,"Unload","X-ray machine parts and dogfood",3274.92,"676010318353","809670514197","Roberta T. Edwards",""
"000000000154",2,1,"Load","Velvet, jogging pants and x-ray machine parts",7644.63,"94795302327","582065089359","Yancey Williams",""
"000000000154",3,1,"Hook","gold",9828.21,"514561330253","102079985899","Oliver Mitchell",""
"000000000154",4,1,"Load","Apples and jogging pants",5925.98,"156486653720","909559908614","Velma Smith",""
"000000000154",6,1,"Hook","Potatoes, engine parts and gold",4458.86,"","883971492629","Roberta Velazquez",""
"000000000154",7,1,"Hook","radium",6816.25,"","","Kevin Grimes",""
"000000000154",8,1,"Drop","Potatoes, lobsters and gold",7327.6,"193192888615","","Roberta Perry",""
"000000000155",2,1,"Hook","Dogfood and lobsters",7382.32,"563464502222","930296157043","Patricia Edwards",""
"000000000155",3,1,"Load","Apples, potatoes, ice cream cones and flash-frozen french fries",3566.7,"","308804482028","Isaiah Grimes",""
"000000000155",3,2,"Unload","Machinery and orange juice",5493.44,"","","Mitchell W. Anderson",""
"000000000155",4,1,"Load","Lobsters, uranium, Caesar salad mix and radium",6679.99,"","","Kevin I. Irvin",""
"000000000155",5,1,"Hook","Lobsters and apples",4716.97,"","44811876136","Patricia Williams",""
"000000000155",6,1,"Unload","Uranium and krazy glue",5505.86,"","452476722211","Quincy Harrison-Benitez",""
"000000000156",2,1,"Hook","potatoes",4691.62,"682252889068","952469585654","Nancy Kern",""
"000000000156",3,1,"Drop","potatoes",5019.76,"32910627658","642629092231","Louise Nelson",""
"000000000156",4,1,"Unload","Nylon stockings, jogging pants, windows and stovepipe hats",8587.62,"","376142890292","Roberta Yarbrough",""
"000000000156",7,1,"Unload","Ice cream cones, bricks, windows and x-ray machine parts",1704.76,"931968856999","289913559717","Ulysses V. French",""
"000000000156",8,1,"Unload","Potatoes, turtle eggs and Caesar salad mix",2729.33,"880465486982","","Kevin L. Edwards",""
"000000000157",2,1,"Hook","Apples and quilts",4184.62,"","708145791368","Harriet Yarbrough",""
"000000000157",4,1,"Unload","lobsters",6853.68,"","","Yancey Jackson",""
"000000000157",5,1,"Unload","X-ray machine parts and windows",2457.81,"791664981985","","Francis N. Kern-Perry",""
"000000000158",2,1,"Load","X-ray machine parts, flash-frozen french fries and orange juice",6722.73,"734012611638","","Nancy Y. Irvin",""
"000000000158",3,1,"Unload","Flash-frozen french fries, orange juice, potatoes and windows",271.6,"817096539049","666313752760","Eduardo Mitchell-Dawson",""
"000000000158",4,1,"Load","gold",2712.36,"686507614672","915909236420","Xaviera T. Kern",""
"000000000158",5,1,"Hook","Krazy glue, velvet and potatoes",5655.74,"614676511480","165570593267","Tammy Yarbrough-Thompson",""
"000000000158",5,2,"Drop","Machinery, turtle eggs and engine parts",4717.37,"972865302795","176337321754","Patricia R. Covington",""
"000000000158",6,1,"Unload","lobsters",1935.93,"226097130184","51550673683","Ulysses Thompson-French",""
"000000000158",7,1,"Load","Machinery and jogging pants",2394.11,"192765896275","","Quincy L. Smith-Grimes",""
"000000000158",7,2,"Drop","X-ray machine parts and turtle eggs",131.9,"71244709358","","Louise U. Kern",""
"000000000158",8,1,"Drop","Apples and orange juice",7467.93,"302397694315","","Betty P. Kern",""
"000000000158",9,1,"Drop","X-ray machine parts, ice cream cones and stovepipe hats",4017.75,"","","Tammy Xing",""
"000000000159",2,1,"Hook","Bricks, velvet, windows and machinery",4012.97,"861923292762","","Louise Harrison",""
"000000000159",6,1,"Hook","Yoyos, dogfood, machinery and krazy glue",5502.97,"","750928478083","William Kern",""
"000000000159",7,1,"Drop","Lobsters and krazy glue",2167.89,"834278404010","577033509925","Betty Perry",""
"000000000160",2,1,"Hook","x-ray machine parts",2671.62,"149980968129","678435223996","Kevin E. Underwood",""
"000000000160",4,1,"Unload","jogging pants",4464.89,"640007854430","176500024297","Nancy Dawson",""
"000000000161",2,1,"Load","X-ray machine parts, velvet and dogfood",171.26,"","753045365584","Charles T. Xing",""
"000000000161",4,1,"Hook","Engine parts, turtle eggs, hot dog buns and orange juice",1821.55,"","","Harriet B. Grimes",""
"000000000161",5,1,"Load","Potatoes and ice cream cones",6949.78,"717683981096","","Samuel H. Irvin",""
"000000000161",8,1,"Drop","Flash-frozen french fries and orange juice",1772.6,"","616917572909","William Harrison","Yancey Jackson"
"000000000161",9,1,"Unload","Quilts and gold",5074.75,"","199808432408","Samuel Williams-Smith",""
"000000000161",10,1,"Hook","Apples and x-ray machine parts",2543.88,"846600397692","","Betty Mitchell-Quasnoy",""
"000000000161",11,1,"Load","Uranium, velvet and yoyos",4750.34,"","11313003960","Danielle I. Mitchell","Isaiah Thompson-Mitchell"
"000000000161",11,2,"Unload","nylon stockings",9518.19,"508315745466","719800399411","Quincy V. Dawson",""
"000000000161",12,1,"Unload","engine parts",5933.51,"","301666076218","Oliver B. Mitchell",""
"000000000161",13,1,"Drop","Caesar salad mix, yoyos and gold",2330.52,"","611816982984","Betty G. Underwood",""
"000000000162",2,1,"Load","Potatoes and flash-frozen french fries",676.47,"102564400765","658583390186","Danielle B. Jackson",""
"000000000162",3,1,"Drop","Nylon stockings, lobsters and hot dog buns",6650.12,"19224502491","","Kevin A. Quasnoy Covington",""
"000000000162",4,1,"Load","Stovepipe hats, bricks, turtle eggs and hot dog buns",8258.91,"265957451117","","Francis B. Yarbrough",""
"000000000162",4,2,"Unload","Gold, x-ray machine parts and yoyos",4559.27,"786649285464","","Francis T. Mitchell",""
