OrderId,StopSequenceNumber,CargoChangeSequenceNumber,CargoChangeType,GeneralDescription,Weight,TruckNumber,TrailerNumber,Driver1Name,Driver2Name
"000000000127",9,2,"Unload","Caesar salad mix and x-ray machine parts",918.29,"464551624811","","Eduardo Perry",""
"000000000127",11,1,"Drop","Windows, x-ray machine parts and nylon stockings",5826.09,"946497314946","","Janice B. Benitez",""
"000000000128",2,1,"Hook","Bricks and lobsters",5323.11,"199875160706","609365105504","Louise D. Mitchell",""
"000000000128",3,1,"Load","Dogfood and jogging pants",3684.48,"","","William R. Smith",""
"000000000128",4,1,"Load","Turtle eggs, lobsters and Caesar salad mix",141.85,"341961764431","772057785489","Eduardo Williams",""
"000000000128",5,1,"Unload","Potatoes, bricks, Caesar salad mix and lobsters",5760.03,"208876012658","","Kevin Perry",""
"000000000129",2,1,"Load","engine parts",7997.9,"838375804704","817717507417","Ulysses X. Lewis-Jackson",""
"000000000129",3,1,"Unload","Orange juice and yoyos",1450.58,"446806310077","708895462899","Danielle Y. Yarbrough","Janice I. Xing"
"000000000129",4,1,"Load","Potatoes, velvet and apples",3465.92,"","","Velma Williams",""
"000000000129",5,1,"Hook","yoyos",9848.67,"539939878531","873707267764","Quincy H. Smith",""
"000000000129",6,1,"Drop","Velvet, lobsters and potatoes",1198.28,"409431603688","895598036196","Patricia Lewis-Benitez",""
"000000000129",7,1,"Unload","windows",9369.52,"903829130153","874388752116","Louise Kern-Quasnoy",""
"000000000129",9,1,"Unload","Lobsters, velvet and windows",7335,"627666152150","57430923439","Tammy K. Thompson",""
"000000000130",2,1,"Hook","hot dog buns",6047.14,"","711499022651","Roberta U. Grimes",""
"000000000130",3,1,"Drop","yoyos",874.26,"517176255973","974204812440","Yancey H. Benitez",""
"000000000130",4,1,"Drop","Hot dog buns and stovepipe hats",475.67,"384754790167","742009472542","Nancy Anderson-Grimes",""
"000000000130",5,1,"Drop","Nylon stockings, radium, yoyos and hot dog buns",8788.95,"16096760284","380145012950","Oliver French",""
"000000000131",2,1,"Load","Velvet and lobsters",6952.6,"881920020642","8356264100","Mitchell Smith",""
"000000000131",4,1,"Load","bricks",5621.86,"","","Mitchell Xing",""
"000000000131",4,2,"Unload","hot dog buns",9781.12,"699692764942","722315771400","Patricia N. Mitchell",""
"000000000131",5,1,"Hook","Flash-frozen french fries and windows",8565.47,"348418560609","","William Jackson-Covington",""
"000000000131",6,1,"Load","Apples, bricks, gold and ice cream cones",2543.54,"","365111986464","William Mitchell Covington",""
"000000000131",7,1,"Unload","Nylon stockings, quilts, stovepipe hats and radium",7942.73,"45026265223","690033311682","Velma Dawson",""
"000000000132",2,1,"Load","Engine parts, potatoes and turtle eggs",7271.7,"41883725522","582908966039","Eduardo X. Kern","Oliver Smith"
"000000000132",3,1,"Load","x-ray machine parts",7872.53,"","374837932883","Mitchell V. Mitchell",""
"000000000132",4,1,"Load","ice cream cones",7964.65,"","256991209358","Quincy A. Grimes",""
"000000000132",4,2,"Drop","Krazy glue and machinery",9753.72,"","543056938957","George L. Perry-Covington","Alfred F. Benitez"
"000000000132",5,1,"Hook","Gold, potatoes and lobsters",9439.43,"301504981806","112787493701","William Grimes",""
"000000000132",7,1,"Drop","Flash-frozen french fries, x-ray machine parts and dogfood",1002.97,"543154126463","975339856384","Charles Quasnoy",""
"000000000133",2,1,"Load","Windows and engine parts",8509.43,"","","Alfred S. French",""
"000000000133",4,1,"Hook","krazy glue",5164.03,"566406674067","829202379533","Ulysses A. Irvin",""
"000000000133",5,1,"Drop","uranium",9594.44,"144451940422","344932331669","Eduardo Williams",""
"000000000134",2,1,"Load","orange juice",6668.32,"","","Betty Covington",""
"000000000134",3,1,"Drop","X-ray machine parts, uranium, nylon stockings and potatoes",1518.58,"","717080591941","Velma Benitez",""
"000000000135",2,1,"Load","Ice cream cones and windows",1027.82,"","327051001170","Francis Kern",""
"000000000135",3,1,"Load","machinery",7918.17,"","","Kevin D. Grimes French",""
"000000000135",3,2,"Drop","Bricks and turtle eggs",7857.43,"220877313075","877886735679","Louise Nelson Thompson",""
"000000000135",4,1,"Load","velvet",3394.67,"","13230178981","Yancey Jackson-Perry",""
"000000000135",4,2,"Unload","Hot dog buns and radium",9647.4,"943983354301","61717682904","George Nelson",""
"000000000135",6,1,"Hook","flash-frozen french fries",6821.09,"584615860618","317914309153","Roberta Jackson-Perry",""
"000000000135",7,1,"Load","apples",9365.61,"126618006970","746962058489","Velma French",""
"000000000135",7,2,"Unload","jogging pants",5685.34,"","","Janice Perry",""
"000000000135",10,1,"Drop","Potatoes, orange juice and dogfood",6697.59,"569767853785","905921615943","Mitchell Underwood","Roberta M. Smith"
"000000000136",2,1,"Hook","Caesar salad mix and windows",8621.97,"","618377900154","Mitchell Jackson Harrison","Oliver Perry"
"000000000136",3,1,"Load","Yoyos, engine parts, jogging pants and bricks",1715.31,"147939368356","","Quincy Thompson",""
"000000000136",3,2,"Unload","Turtle eggs, jogging pants, krazy glue and radium",6320.82,"","23287675383","Mitchell Jackson",""
"000000000136",4,1,"Drop","Radium and hot dog buns",8364.06,"131641554211","","Harriet Anderson",""
"000000000136",5,1,"Unload","Dogfood, quilts and orange juice",7743.42,"769275116985","91293225687","Francis V. Velazquez",""
"000000000136",6,1,"Load","Quilts and x-ray machine parts",5529.94,"132827576901","","George Harrison",""
"000000000136",6,2,"Drop","Velvet, quilts and ice cream cones",5975.57,"766040694171","304870520233","Betty Covington",""
"000000000136",7,1,"Load","Bricks, dogfood, radium and velvet",6942.26,"150222864574","828890434025","Nancy Benitez",""
"000000000136",8,1,"Unload","Turtle eggs and apples",5371.57,"598489459553","584543722774","George Benitez O'Toole","Betty O'Toole"
"000000000136",9,1,"Load","Caesar salad mix, hot dog buns, gold and orange juice",2263.37,"573193203800","676410234580","Yancey M. Edwards",""
"000000000136",9,2,"Unload","Dogfood and machinery",665.67,"","276467936648","Janice Mitchell",""
"000000000136",10,1,"Unload","lobsters",6846.23,"","234260716057","Tammy X. Ramakrishnan",""
"000000000137",2,1,"Hook","X-ray machine parts, turtle eggs, flash-frozen french fries and potatoes",5928.82,"612338160233","559926544887","Yancey Anderson",""
"000000000137",3,1,"Hook","orange juice",8352.96,"230290694521","639220315230","Yancey T. Dawson",""
"000000000137",4,1,"Load","Turtle eggs and machinery",1174.65,"415359818063","","Tammy Lewis","Ulysses Y. Benitez"
"000000000137",5,1,"Load","Apples, machinery and jogging pants",8477.98,"","78554608582","Nancy P. Perry",""
"000000000137",6,1,"Unload","Windows and quilts",2735.95,"","","Isaiah Grimes",""
"000000000138",2,1,"Load","Quilts and windows",9332.44,"","","William O. Williams",""
"000000000138",3,1,"Drop","Apples and radium",512.28,"329657990178","","Samuel Nelson",""
"000000000139",2,1,"Load","Caesar salad mix, potatoes and velvet",5725.4,"","997960302363","Samuel U. Lewis",""
"000000000139",3,1,"Drop","Jogging pants, bricks, machinery and radium",8743.26,"947636778238","","Oliver B. Covington",""
"000000000140",2,1,"Hook","dogfood",2247.76,"","","Patricia T. French-Perry",""
"000000000140",3,1,"Unload","Flash-frozen french fries, nylon stockings and engine parts",1440.48,"","","Alfred Williams",""
"000000000140",4,1,"Drop","orange juice",6959.82,"539605895297","712313011252","William Mitchell",""
"000000000140",5,1,"Hook","Windows, uranium and Caesar salad mix",6641.91,"356054737695","","Nancy W. Quasnoy","William Quasnoy"
"000000000140",6,1,"Hook","Windows, dogfood and lobsters",8266.22,"","696652270194","William Harrison-Covington",""
"000000000140",7,1,"Load","stovepipe hats",8746.43,"67375504378","","Velma R. Benitez",""
"000000000140",8,1,"Hook","Flash-frozen french fries and nylon stockings",2602.12,"530842259575","287230019442","Francis W. Smith-Thompson",""
"000000000140",9,1,"Load","potatoes",2461.3,"22857417291","512041380786","Nancy Y. Jackson",""
"000000000140",10,1,"Drop","Hot dog buns and x-ray machine parts",580.48,"292103350095","","Nancy Q. Velazquez",""
"000000000141",2,1,"Load","Yoyos, stovepipe hats, jogging pants and turtle eggs",3041.35,"876699490045","82634448320","Eduardo Jackson",""
"000000000141",3,1,"Unload","Flash-frozen french fries, apples and machinery",943.83,"","","Harriet Yarbrough","Isaiah Jackson"
"000000000141",4,1,"Unload","Krazy glue and hot dog buns",1459.19,"340154037535","239197190661","Xaviera H. Ramakrishnan",""
"000000000141",6,1,"Hook","Dogfood and quilts",8386.12,"294944975879","","Alfred E. Lewis",""
"000000000141",6,2,"Unload","Radium, gold and Caesar salad mix",9637.52,"479668149963","180599831772","William P. Edwards",""
"000000000141",8,1,"Drop","Potatoes, dogfood and stovepipe hats",9076.62,"506427424539","461522139020","Charles M. Nelson",""
"000000000141",9,1,"Drop","Jogging pants, ice cream cones and nylon stockings",4910.64,"830787086780","85427597499","Charles Anderson",""
"000000000142",2,1,"Load","lobsters",710.21,"918734133851","799724604024","Oliver J. Dawson",""
"000000000142",3,1,"Drop","quilts",5889.78,"912373519153","358608931984","Xaviera Underwood",""
"000000000142",4,1,"Unload","Engine parts, Caesar salad mix and gold",7098.93,"626496907600","558840809738","Tammy C. Quasnoy",""
"000000000142",5,1,"Drop","hot dog buns",4524.03,"39415093039","912523352276","Xaviera I. Smith",""
"000000000142",6,1,"Hook","Lobsters, krazy glue, dogfood and machinery",6585.57,"102658005962","3216270921","Eduardo B. Xing",""
"000000000142",7,1,"Hook","Turtle eggs, uranium, machinery and gold",6538.02,"835707424069","909510181871","Eduardo H. Underwood","Isaiah Y. Kern"
"000000000142",7,2,"Unload","nylon stockings",7510.63,"726074150811","","Isaiah Perry",""
"000000000142",8,1,"Drop","ice cream cones",3239.49,"119051059481","","Tammy G. Yarbrough",""
"000000000142",9,1,"Load","Apples and krazy glue",4971.61,"648355581109","356561922984","Charles Anderson Grimes","Nancy Yarbrough"
"000000000142",9,2,"Unload","Hot dog buns and engine parts",3365.94,"","840231842295","George Thompson",""
"000000000142",10,1,"Load","Bricks, dogfood, lobsters and radium",2789.98,"","","Oliver Anderson",""
"000000000142",11,1,"Drop","Velvet, orange juice and jogging pants",7314.11,"823258249617","437794372130","Xaviera Smith",""
"000000000143",2,1,"Load","Velvet, stovepipe hats and nylon stockings",1317.54,"949710843594","308690605196","George Lewis",""
"000000000143",3,1,"Drop","Uranium, x-ray machine parts, stovepipe hats and engine parts",7192.87,"95033740887","","Mitchell Nelson",""
"000000000143",4,1,"Drop","Caesar salad mix",3415.93,"201281786796","","Xaviera H. Edwards",""
"000000000143",5,1,"Drop","krazy glue",317.98,"613363644299","","Ulysses Y. Anderson",""
"000000000143",8,1,"Drop","ice cream cones",3929.8,"612577513521","85544818707","Charles Kern-Dawson",""
"000000000143",10,1,"Unload","Yoyos, nylon stockings and lobsters",8535.71,"","","Francis Grimes",""
"000000000143",11,1,"Load","Flash-frozen french fries, stovepipe hats, gold and nylon stockings",7979.92,"892483505815","936507469691","Kevin D. Harrison",""
"000000000143",12,1,"Drop","Radium, yoyos, lobsters and bricks",6346.47,"","315463813086","Harriet C. Perry",""
"000000000144",2,1,"Load","Machinery, velvet, krazy glue and ice cream cones",6365.49,"951531103217","","Oliver Jackson","George H. Yarbrough"
"000000000144",5,1,"Unload","Yoyos and hot dog buns",7954.78,"753759027103","18750406989","Danielle Xing-Dawson",""
"000000000144",6,1,"Unload","radium",2230.91,"","666572180595","Xaviera P. Irvin",""
"000000000145",2,1,"Load","Gold, ice cream cones and krazy glue",2326.65,"","186455021754","Xaviera Nelson-Perry",""
"000000000145",3,1,"Drop","Yoyos, quilts and orange juice",9734.89,"330627469010","321056579323","Louise Covington",""
"000000000146",2,1,"Hook","Turtle eggs and lobsters",531.35,"","","Janice R. Kern",""
"000000000146",3,1,"Unload","uranium",247.14,"","508365604972","Eduardo U. Irvin",""
"000000000147",2,1,"Load","Apples, windows and ice cream cones",7690.81,"256084000949","309542862506","Louise Ramakrishnan",""
"000000000147",3,1,"Drop","Bricks, ice cream cones and apples",2651.28,"","","Ulysses Q. Grimes",""
"000000000147",4,1,"Load","krazy glue",2762.64,"263930212550","","Francis Velazquez",""
"000000000147",5,1,"Load","Orange juice and lobsters",4169.02,"948993293564","717907341782","William French",""
"000000000147",5,2,"Unload","Turtle eggs and potatoes",8937,"","","Mitchell A. Mitchell",""
"000000000147",6,1,"Drop","Caesar salad mix",5077,"956949557936","","Mitchell Xing",""
"000000000148",2,1,"Load","yoyos",1290.47,"705636688336","538060654352","William French","Isaiah Xing-O'Toole"
"000000000148",3,1,"Hook","Lobsters and krazy glue",1427.53,"171912300876","","Quincy Jackson",""
"000000000148",3,2,"Unload","engine parts",4413.36,"789372664814","","Danielle O'Toole-Anderson",""
"000000000148",7,1,"Load","Bricks, uranium, radium and hot dog buns",4102.09,"559938035308","799645567154","Janice D. Jackson",""
"000000000148",7,2,"Unload","Lobsters and krazy glue",7792.94,"33337660244","451962612487","Janice Jackson",""
"000000000148",9,1,"Hook","Caesar salad mix, lobsters and hot dog buns",5971.18,"","242483586015","Charles Yarbrough-Anderson",""
"000000000148",9,2,"Drop","uranium",4980.35,"970821303689","","Harriet Williams",""
"000000000148",10,1,"Load","machinery",192.23,"186552067044","504384618999","Xaviera C. Mitchell",""
"000000000148",10,2,"Drop","Caesar salad mix and dogfood",4142.89,"","173328888836","Louise Yarbrough","Betty Mitchell"
"000000000148",12,1,"Drop","Caesar salad mix, turtle eggs and bricks",9457.28,"","329476471104","Louise Quasnoy-Irvin",""
"000000000149",2,1,"Hook","Bricks, krazy glue, flash-frozen french fries and nylon stockings",8951.26,"723431574702","583656883919","Patricia F. Nelson",""
"000000000149",3,1,"Load","Lobsters, krazy glue, machinery and nylon stockings",9140.52,"493634299722","103470501979","Velma W. Quasnoy",""
"000000000149",3,2,"Unload","Uranium, velvet and Caesar salad mix",7114.93,"353259464632","","Patricia Y. Ramakrishnan",""
"000000000149",4,1,"Load","Lobsters and orange juice",3330.56,"","212836045847","George D. Xing",""
"000000000149",5,1,"Load","Dogfood, orange juice and radium",4724.92,"547987394730","183804938974","Velma Velazquez",""
"000000000149",6,1,"Hook","stovepipe hats",9367.17,"","665942309933","Mitchell Covington",""
"000000000149",6,2,"Unload","Uranium and velvet",6122.99,"","773869914560","Velma B. Dawson",""
"000000000149",7,1,"Unload","X-ray machine parts, potatoes and jogging pants",599.32,"806131942400","640171847468","Janice U. Kern Velazquez",""
"000000000150",2,1,"Hook","krazy glue",9713.65,"","905981259618","Danielle Lewis Ramakrishnan",""
"000000000150",3,1,"Drop","windows",6531.19,"411739649827","","Xaviera M. Benitez","Betty Ramakrishnan-Quasnoy"
"000000000150",5,1,"Hook","Engine parts and jogging pants",5997.67,"402180901920","967730029635","Harriet Ramakrishnan",""
"000000000150",5,2,"Unload","Caesar salad mix, gold and potatoes",5950.37,"219802051858","719950158130","Louise T. Edwards",""
"000000000150",6,1,"Load","lobsters",6995.51,"53720853215","685491395463","Oliver Mitchell",""
"000000000150",6,2,"Unload","dogfood",722.97,"","64429251777","Ulysses Xing",""
"000000000150",7,1,"Drop","turtle eggs",6396,"463089458565","788488671093","Mitchell Underwood",""
"000000000150",8,1,"Drop","nylon stockings",9605.55,"694217713878","","William Kern",""
"000000000151",2,1,"Load","Potatoes and uranium",7697.12,"345261874037","443657511968","Harriet Covington",""
"000000000151",4,1,"Hook","Turtle eggs and velvet",3892.99,"670961138102","691301420665","Eduardo Y. Underwood",""
"000000000151",5,1,"Load","nylon stockings",4371.81,"97470436080","746650001369","Isaiah E. Quasnoy",""
"000000000151",5,2,"Unload","Yoyos, radium, hot dog buns and flash-frozen french fries",8481.38,"818688530598","532021156378","Samuel H. Williams-Xing",""
"000000000151",6,1,"Hook","Gold, velvet, hot dog buns and orange juice",7030.39,"303758389","","Velma X. Irvin",""
"000000000151",8,1,"Load","Hot dog buns, apples, turtle eggs and potatoes",8839.46,"919924402460","293256729650","Velma J. Underwood",""
"000000000151",10,1,"Unload","Turtle eggs, lobsters and nylon stockings",9017.63,"36955956364","343530709877","Janice Williams Benitez",""
"000000000152",2,1,"Hook","Quilts, dogfood and radium",1794.5,"","349260651971","Yancey Perry",""
"000000000152",3,1,"Hook","Engine parts and turtle eggs",8473.01,"","","Roberta Velazquez",""
"000000000152",4,1,"Load","Velvet, orange juice and bricks",9805.96,"847154231802","365250448707","Alfred Q. Smith",""
"000000000152",5,1,"Drop","flash-frozen french fries",100.54,"","356458777653","Nancy Thompson",""
"000000000153",2,1,"Hook","Lobsters and radium",6917.44,"","","Yancey French",""
"000000000153",4,1,"Hook","x-ray machine parts",4951.43,"","784821328233","Kevin B. Underwood",""
"000000000153",4,2,"Drop","Velvet and uranium",2308.97,"606419305547","","Samuel D. Smith Mitchell",""
"000000000153",5,1,"Load","Radium, gold and uranium",4041.57,"237009032140","497461613433","Janice F. Underwood",""
"000000000153",5,2,"Unload","potatoes",462.2,"327783972783","771773426612","Samuel U. Velazquez-Lewis",""
"000000000153",6,1,"Load","Engine parts and krazy glue",5758.97,"509320979520","20587822275","Francis I. Smith",""
"000000000153",6,2,"Unload","hot dog buns",192.12,"210893000379","756814981019","Louise Underwood",""
"000000000153",7,1,"Hook","turtle eggs",4298.11,"644621191691","","Roberta T. O'Toole-Jackson","Kevin Jackson-Irvin"
"000000000153",7,2,"Unload","yoyos",3761.66,"430698764160","","William Edwards",""
"000000000153",8,1,"Load","Ice cream cones, radium and krazy glue",5559.34,"450154311518","","George C. Benitez",""
"000000000153",9,1,"Drop","Yoyos and jogging pants",7148.72,"941214995527","978332754003","Mitchell Covington","Betty Nelson"
"000000000154",2,1,"Load","Radium, gold and velvet",2500,"767124805501","539461735846","Louise T. Mitchell",""
"000000000154",3,1,"Hook","Nylon stockings, radium and gold",682.62,"751975479088","727632185641","William Anderson",""
"000000000154",4,1,"Unload","hot dog buns",6626.75,"","","Yancey I. Benitez",""
"000000000154",5,1,"Drop","Velvet, potatoes, engine parts and x-ray machine parts",2257.67,"","","Janice R. Xing",""
"000000000155",2,1,"Load","nylon stockings",6899.51,"830859041840","","Nancy Benitez",""
"000000000155",3,1,"Hook","Caesar salad mix, apples and gold",9630.6,"","746148819128","Danielle Anderson",""
"000000000155",3,2,"Drop","Engine parts and ice cream cones",9310.81,"","746433035884","Ulysses Xing",""
"000000000155",4,1,"Hook","lobsters",6402.37,"515256555356","818064236513","Kevin Harrison",""
"000000000155",4,2,"Drop","Potatoes, nylon stockings and jogging pants",4954.59,"219354299190","593902954704","Janice P. Ramakrishnan",""
"000000000155",5,1,"Unload","Engine parts, Caesar salad mix and jogging pants",5764.64,"","756950182852","Quincy Nelson",""
"000000000155",6,1,"Load","radium",2770.34,"","550062558725","Alfred Y. Mitchell",""
"000000000155",6,2,"Unload","Stovepipe hats, flash-frozen french fries and x-ray machine parts",3884.05,"970664456631","954437736907","Mitchell Perry",""
"000000000155",7,1,"Hook","Orange juice, flash-frozen french fries, ice cream cones and nylon stockings",5190.03,"","788348727764","Isaiah R. Lewis Irvin",""
"000000000155",7,2,"Unload","Flash-frozen french fries, dogfood, lobsters and uranium",6969.29,"518247620272","","George N. Edwards",""
"000000000155",8,1,"Unload","Windows and x-ray machine parts",4409.49,"","","Samuel French",""
"000000000156",2,1,"Hook","Hot dog buns, ice cream cones, dogfood and flash-frozen french fries",6748.03,"223656768332","","Xaviera Kern-Edwards",""
"000000000156",4,1,"Hook","dogfood",2147.21,"","762509533105","Yancey Yarbrough",""
"000000000156",6,1,"Load","Engine parts and ice cream cones",7470.52,"","850855798666","George T. Williams",""
"000000000156",8,1,"Drop","Windows and ice cream cones",7417.28,"89963362467","968778988997","Samuel Mitchell-Perry",""
"000000000157",2,1,"Hook","Flash-frozen french fries, windows, machinery and radium",7144.08,"","120963899191","Samuel K. Perry",""
"000000000157",3,1,"Hook","Nylon stockings and quilts",7958.68,"","554185226611","George H. Perry",""
"000000000157",3,2,"Unload","jogging pants",1828.45,"985322249313","","Alfred Lewis",""
"000000000157",4,1,"Hook","Engine parts, gold, stovepipe hats and windows",2700.07,"509118937160","158094629549","Nancy A. Covington-Dawson",""
"000000000157",4,2,"Drop","Gold, bricks, x-ray machine parts and windows",5677.1,"","","Oliver Quasnoy",""
"000000000157",5,1,"Load","Ice cream cones, Caesar salad mix, dogfood and potatoes",1216.85,"148432050459","","Nancy R. Ramakrishnan",""
"000000000157",5,2,"Unload","Nylon stockings, velvet, flash-frozen french fries and ice cream cones",5612.76,"","494836744633","George K. Nelson",""
"000000000157",6,1,"Load","apples",3858.51,"113681527256","569797980007","George Lewis",""
"000000000157",6,2,"Unload","Nylon stockings, bricks and stovepipe hats",2264.59,"478368914479","357307512630","Eduardo R. Irvin",""
"000000000157",7,1,"Unload","Turtle eggs, engine parts and x-ray machine parts",9403.61,"613275021903","581841556487","Harriet C. Kern",""
"000000000157",8,1,"Unload","Turtle eggs, jogging pants and lobsters",3292.21,"967263917050","337276056546","Quincy A. Benitez",""
"000000000157",9,1,"Drop","Gold and Caesar salad mix",7355.16,"935147444231","","Isaiah Ramakrishnan",""
"000000000158",2,1,"Hook","Lobsters, krazy glue and stovepipe hats",4508.87,"","893402279870","Eduardo Yarbrough",""
"000000000158",3,1,"Drop","jogging pants",2765.44,"306627740018","263629591749","Quincy P. Kern-Smith",""
"000000000158",4,1,"Load","radium",1665.02,"","326437437567","Danielle Velazquez",""
"000000000158",5,1,"Load","bricks",4954.98,"","170158864455","Betty Underwood",""
"000000000158",5,2,"Drop","apples",6938.89,"","","Nancy Xing",""
"000000000158",6,1,"Hook","lobsters",7872.7,"207567946210","478108376137","Kevin Jackson","Kevin D. Xing"
"000000000158",7,1,"Hook","Lobsters and turtle eggs",3328.01,"","","Alfred L. French",""
"000000000158",7,2,"Drop","Hot dog buns and potatoes",9476.53,"824073826289","124055015506","Alfred Nelson",""
"000000000158",8,1,"Unload","Caesar salad mix",2795.19,"182177551122","","Nancy C. Mitchell",""
"000000000158",11,1,"Hook","Krazy glue, uranium, radium and turtle eggs",748.21,"","110286346659","Charles X. French",""
"000000000158",12,1,"Drop","Bricks, gold, x-ray machine parts and stovepipe hats",5715.9,"431903818453","504026101819","Kevin Quasnoy",""
"000000000158",13,1,"Load","Orange juice, turtle eggs and dogfood",9997.05,"420526974514","187602162701","Danielle Mitchell",""
"000000000158",13,2,"Drop","Stovepipe hats, orange juice and x-ray machine parts",5906.98,"","244370184","Samuel Dawson",""
"000000000158",15,1,"Load","Yoyos, apples and flash-frozen french fries",9930.54,"","518371822718","Francis Underwood","Francis P. Quasnoy"
"000000000158",17,1,"Hook","X-ray machine parts, orange juice, ice cream cones and krazy glue",1608.03,"","","Mitchell T. Mitchell",""
"000000000158",17,2,"Unload","Apples and x-ray machine parts",3783.86,"","520045409828","Quincy N. O'Toole",""
"000000000158",18,1,"Drop","Engine parts, krazy glue, flash-frozen french fries and stovepipe hats",2848.82,"897947842416","464418360003","Samuel H. Anderson",""
"000000000158",20,1,"Drop","Windows, flash-frozen french fries, yoyos and x-ray machine parts",3247.75,"948826080471","270056981847","Velma Williams Covington",""
"000000000159",2,1,"Load","nylon stockings",6565.42,"29835478534","","Ulysses French",""
"000000000159",3,1,"Load","Flash-frozen french fries, radium and ice cream cones",2610.53,"220584070022","196711449418","Roberta Williams",""
"000000000159",3,2,"Drop","Potatoes, radium and uranium",8049.82,"487746085626","13961650274","Louise Mitchell",""
"000000000159",5,1,"Drop","machinery",4139.43,"256032279791","459591120266","Xaviera Underwood-Jackson",""
"000000000159",6,1,"Drop","turtle eggs",9499.58,"40085945693","","George Anderson","Xaviera V. Nelson Covington"
"000000000159",7,1,"Drop","machinery",8184.21,"512188132385","","Roberta Quasnoy",""
"000000000160",2,1,"Load","Yoyos, nylon stockings and engine parts",1204.47,"152074300399","437855310440","Kevin B. Ramakrishnan-Lewis",""
"000000000160",3,1,"Load","Windows, Caesar salad mix, machinery and velvet",4277.13,"525569694896","","Charles Nelson","Janice C. Kern-Harrison"
"000000000160",3,2,"Drop","Lobsters, velvet and jogging pants",4877.14,"678014172816","","Mitchell J. Covington",""
"000000000160",4,1,"Hook","Apples, velvet, nylon stockings and ice cream cones",3862.81,"522853405527","65396195231","Patricia Nelson","Charles X. Dawson"
"000000000160",5,1,"Load","Orange juice and krazy glue",6286.6,"","560719089551","Ulysses X. French",""
"000000000160",7,1,"Load","Dogfood, yoyos, gold and machinery",8854.4,"340112301521","211703833668","Patricia E. Quasnoy","Tammy J. Harrison-Velazquez"
"000000000160",8,1,"Load","Turtle eggs and krazy glue",5547.67,"","330082891828","William D. Williams","Velma T. Grimes-Anderson"
"000000000160",8,2,"Drop","Engine parts, lobsters, windows and radium",3747.21,"894552192044","","Francis Quasnoy",""
"000000000160",9,1,"Hook","Caesar salad mix",8165.88,"202452067524","","Ulysses S. Jackson",""
"000000000160",9,2,"Drop","Lobsters and dogfood",4668.46,"","344241134815","Quincy Covington-O'Toole",""
"000000000160",11,1,"Unload","Uranium and turtle eggs",3936.61,"432650246952","356817460649","Betty W. Nelson",""
"000000000161",2,1,"Hook","Gold, hot dog buns and velvet",8884.11,"","520636529795","Alfred Y. Edwards-Perry",""
