OrderId,StopSequenceNumber,CargoChangeSequenceNumber,CargoChangeType,GeneralDescription,Weight,TruckNumber,TrailerNumber,Driver1Name,Driver2Name
"000000000349",3,1,"Drop","Stovepipe hats and dogfood",2024.91,"362388114077","","Quincy Quasnoy Irvin",""
"000000000349",7,1,"Unload","Ice cream cones, orange juice, velvet and yoyos",5087.06,"540788551158","772867760559","Eduardo U. Jackson",""
"000000000349",8,1,"Drop","X-ray machine parts, nylon stockings and jogging pants",5611.78,"713219858980","","Samuel Ramakrishnan-Quasnoy",""
"000000000349",9,1,"Unload","Stovepipe hats and jogging pants",4376.02,"","","Kevin Quasnoy",""
"000000000350",2,1,"Hook","Gold, lobsters and x-ray machine parts",1883.89,"84630046211","922138482253","Danielle Irvin","Quincy Covington"
"000000000350",3,1,"Load","Windows, machinery and velvet",943.93,"575833458136","","Mitchell H. Edwards Quasnoy",""
"000000000350",5,1,"Load","Dogfood and apples",8362.2,"685838079041","313773353878","Mitchell Mitchell",""
"000000000350",5,2,"Unload","stovepipe hats",6881.53,"427010669820","","Mitchell Williams","Janice Underwood"
"000000000350",6,1,"Unload","Lobsters and engine parts",6632.87,"210150723616","548401546848","Louise Covington",""
"000000000351",2,1,"Load","Caesar salad mix and velvet",967.5,"558722883512","701476620215","Francis R. Yarbrough",""
"000000000351",7,1,"Hook","bricks",5887.35,"486380294916","822819414664","Isaiah R. Jackson",""
"000000000351",9,1,"Drop","Caesar salad mix, dogfood, ice cream cones and x-ray machine parts",3580.54,"","","Charles Perry",""
"000000000352",2,1,"Hook","Turtle eggs, Caesar salad mix and uranium",1990.56,"343247224137","231137995421","Janice M. Mitchell-Anderson",""
"000000000352",3,1,"Load","nylon stockings",9246,"","586320141639","Velma Velazquez Covington",""
"000000000352",3,2,"Drop","apples",4483.29,"","","Roberta Harrison",""
"000000000352",4,1,"Hook","Hot dog buns and bricks",2454.02,"401690437467","749054452820","George Lewis",""
"000000000352",4,2,"Unload","apples",8999.3,"608225863466","438377290207","Janice Anderson",""
"000000000352",6,1,"Load","Yoyos, nylon stockings and hot dog buns",4502.48,"1317753851","","Louise French",""
"000000000352",6,2,"Unload","Jogging pants, machinery, hot dog buns and quilts",8697.24,"","284135888145","Patricia G. Perry",""
"000000000352",7,1,"Drop","Bricks, windows, nylon stockings and hot dog buns",1630.72,"82182023123","737360439250","Xaviera Lewis",""
"000000000353",2,1,"Hook","krazy glue",454.28,"542150439885","","Danielle Smith",""
"000000000353",3,1,"Load","orange juice",7147.26,"","3423531409","George Perry",""
"000000000353",3,2,"Unload","Uranium, velvet and krazy glue",5833.83,"753461109604","","Xaviera Velazquez",""
"000000000353",5,1,"Hook","Dogfood, x-ray machine parts, yoyos and ice cream cones",3585.27,"102584763933","487001866143","Nancy Benitez",""
"000000000353",6,1,"Load","bricks",1502.69,"320872655279","","Louise Lewis",""
"000000000353",6,2,"Unload","X-ray machine parts and gold",623.87,"699730621777","359772660530","Kevin Yarbrough-Underwood","Roberta X. Yarbrough-Xing"
"000000000353",7,1,"Unload","Ice cream cones, jogging pants and yoyos",4061.08,"503169313123","973443472674","Nancy Thompson",""
"000000000353",9,1,"Unload","Dogfood, stovepipe hats, flash-frozen french fries and ice cream cones",4267.35,"64271629207","106027532087","Mitchell Quasnoy",""
"000000000354",2,1,"Hook","turtle eggs",3907.95,"","569926671703","Xaviera Mitchell",""
"000000000354",4,1,"Hook","Potatoes, turtle eggs, lobsters and windows",6923.11,"554058572795","409163841972","Mitchell Y. Kern-Ramakrishnan",""
"000000000354",4,2,"Unload","Caesar salad mix",3904.36,"","962025680756","Oliver Mitchell","Harriet Ramakrishnan"
"000000000354",5,1,"Hook","Yoyos, radium and Caesar salad mix",2475.98,"901115588020","390427210587","Betty Lewis-Quasnoy",""
"000000000354",5,2,"Unload","windows",6162.17,"284817740200","954559568372","Mitchell Velazquez",""
"000000000354",6,1,"Hook","Bricks, potatoes and orange juice",9780.11,"315487527912","585334313796","Louise W. Benitez Irvin","Danielle French"
"000000000354",7,1,"Load","Bricks, windows, uranium and apples",4927.99,"","645220038547","Xaviera Harrison",""
"000000000354",7,2,"Drop","Nylon stockings, jogging pants and orange juice",5727.02,"50503097752","","Nancy Anderson-Covington",""
"000000000354",8,1,"Drop","Orange juice, turtle eggs and hot dog buns",6383.42,"","525570773769","Velma Edwards-Jackson","Harriet Harrison-Nelson"
"000000000354",9,1,"Unload","jogging pants",2953.37,"","","Louise I. Nelson-Covington",""
"000000000354",11,1,"Drop","Nylon stockings, stovepipe hats and krazy glue",133.7,"","","Betty T. Anderson",""
"000000000354",12,1,"Unload","velvet",8178.96,"732404869220","620378407335","Janice Edwards",""
"000000000354",13,1,"Hook","yoyos",5332.53,"820153235923","771283582879","Velma C. Covington","Tammy Benitez-Irvin"
"000000000354",13,2,"Unload","Nylon stockings, bricks, machinery and lobsters",8417.68,"631014541547","","George Smith",""
"000000000354",14,1,"Drop","hot dog buns",4030.77,"","","Oliver Kern",""
"000000000354",15,1,"Unload","Uranium, stovepipe hats and krazy glue",1431.63,"715386863797","","Oliver Covington",""
"000000000355",2,1,"Hook","X-ray machine parts and velvet",4794.46,"39737415057","483056167486","Francis G. Lewis",""
"000000000355",3,1,"Load","Apples and stovepipe hats",1277.9,"710152901896","926416544237","Kevin Harrison",""
"000000000355",4,1,"Hook","Flash-frozen french fries and potatoes",1918.87,"","799125511860","Louise E. Mitchell",""
"000000000355",4,2,"Drop","potatoes",400.39,"679276792706","","Yancey D. Dawson-Kern",""
"000000000355",6,1,"Load","Orange juice and windows",756.45,"112718573612","516012423416","Charles H. Irvin Xing",""
"000000000355",6,2,"Unload","Machinery and windows",6080.43,"","294270913048","Xaviera Grimes",""
"000000000355",7,1,"Load","Turtle eggs, nylon stockings, windows and krazy glue",9202.32,"227941290942","413147039089","Tammy Velazquez",""
"000000000355",9,1,"Hook","turtle eggs",9017.09,"","550721267724","Harriet Lewis",""
"000000000355",9,2,"Drop","Flash-frozen french fries, bricks, potatoes and machinery",2498.97,"773381905177","55950369834","Francis D. Lewis-Perry",""
"000000000355",10,1,"Load","gold",8329.67,"","52998361630","Xaviera D. Irvin","Betty Jackson"
"000000000355",10,2,"Unload","Ice cream cones and Caesar salad mix",3959.63,"217002248056","761747256420","Danielle A. Dawson Xing","Louise C. Jackson"
"000000000355",11,1,"Load","Lobsters and potatoes",8429.66,"136315800900","","Francis B. O'Toole-Thompson",""
"000000000355",11,2,"Unload","Stovepipe hats and hot dog buns",7485.92,"929984926708","739886651511","Eduardo Yarbrough Irvin",""
"000000000355",12,1,"Drop","Stovepipe hats, orange juice, quilts and uranium",9802.35,"","","George Anderson Mitchell",""
"000000000356",2,1,"Hook","Flash-frozen french fries, uranium and turtle eggs",3405.54,"516349464235","797274227152","William Kern",""
"000000000356",5,1,"Unload","Nylon stockings, uranium, lobsters and potatoes",5536.73,"907848854503","683108992899","Kevin L. Jackson",""
"000000000357",2,1,"Hook","Hot dog buns and engine parts",2456.61,"246893296497","","Quincy Benitez",""
"000000000357",4,1,"Hook","Stovepipe hats and orange juice",9381.55,"","","Roberta Y. O'Toole",""
"000000000357",4,2,"Drop","Dogfood and gold",5426.77,"284598175373","403874938341","Oliver Velazquez","Oliver Q. Harrison"
"000000000357",5,1,"Unload","Engine parts, apples and potatoes",2925.67,"268879216040","823845058929","Charles Kern",""
"000000000358",2,1,"Hook","uranium",6219.39,"650190956207","","Kevin A. Williams",""
"000000000358",6,1,"Hook","Machinery, uranium and orange juice",5636.39,"89022388463","","Betty Anderson",""
"000000000358",8,1,"Hook","Apples and jogging pants",1360.65,"954725476327","","Samuel Yarbrough",""
"000000000358",9,1,"Unload","Caesar salad mix",4128.31,"","","Ulysses E. Quasnoy",""
"000000000358",11,1,"Drop","Quilts, gold and Caesar salad mix",7362.52,"776771016013","","Xaviera L. Covington",""
"000000000359",2,1,"Hook","Nylon stockings and uranium",1846.47,"","745787118005","Isaiah Covington Ramakrishnan",""
"000000000359",3,1,"Unload","Radium, orange juice and bricks",9693.29,"","","William Underwood French",""
"000000000359",4,1,"Unload","Windows, lobsters, nylon stockings and stovepipe hats",9795.71,"562533567044","269165579735","Betty M. O'Toole",""
"000000000359",9,1,"Unload","Orange juice, windows and x-ray machine parts",4053.33,"","682797802049","Nancy Thompson",""
"000000000359",10,1,"Drop","Hot dog buns and Caesar salad mix",2862.88,"377396627346","178148153245","Velma Y. Thompson",""
"000000000359",12,1,"Drop","krazy glue",6161.9,"979986677801","","Nancy Y. Perry",""
"000000000360",2,1,"Load","bricks",5521.86,"566402611723","","Xaviera Anderson","Oliver Y. Xing"
"000000000360",3,1,"Unload","Jogging pants and bricks",2022.98,"","647509501602","Janice A. Williams",""
"000000000360",4,1,"Drop","flash-frozen french fries",3161.18,"","","Oliver Xing",""
"000000000360",5,1,"Hook","Apples, quilts, turtle eggs and ice cream cones",7179.03,"404848477614","","Samuel O. Dawson",""
"000000000360",6,1,"Load","Windows and lobsters",7697.93,"810232329156","","Kevin Quasnoy",""
"000000000360",6,2,"Unload","Engine parts and jogging pants",2767.06,"164029595993","845454197727","Tammy Smith-Dawson",""
"000000000360",7,1,"Unload","nylon stockings",8896.62,"","981600905366","Samuel E. Benitez","Tammy Perry"
"000000000361",2,1,"Hook","Windows and lobsters",3525.89,"652347325240","","Velma T. O'Toole-Kern",""
"000000000361",6,1,"Unload","Lobsters, potatoes and hot dog buns",7608.43,"548966008514","495232376072","Yancey J. Mitchell-Jackson",""
"000000000361",8,1,"Unload","Dogfood and nylon stockings",2050.15,"227803169185","56009955531","Eduardo P. Perry",""
"000000000362",2,1,"Hook","apples",418.11,"610664576199","85720206047","Mitchell Xing",""
"000000000362",3,1,"Hook","Turtle eggs, apples, uranium and potatoes",4943.62,"463750924074","71012952342","Roberta G. Mitchell",""
"000000000362",3,2,"Drop","Hot dog buns, radium and ice cream cones",6157.69,"","","Francis Dawson",""
"000000000362",4,1,"Load","Flash-frozen french fries, lobsters and radium",8449.25,"508777314994","942977013113","Janice Irvin",""
"000000000362",4,2,"Drop","Bricks and orange juice",9998.41,"272928835765","","Roberta Anderson-Kern",""
"000000000362",5,1,"Load","Dogfood and nylon stockings",3621.51,"395189948452","867476531359","Patricia K. Williams",""
"000000000362",5,2,"Unload","Yoyos, velvet, flash-frozen french fries and dogfood",9870.35,"703933855376","741348988533","Charles Y. Anderson-Dawson",""
"000000000362",6,1,"Load","ice cream cones",8401.25,"908561926389","17089547843","Nancy Dawson",""
"000000000362",6,2,"Drop","Nylon stockings, bricks, krazy glue and hot dog buns",2910.87,"253049355726","","Danielle Benitez",""
"000000000362",7,1,"Drop","Gold, jogging pants and flash-frozen french fries",4513.72,"","","William O'Toole",""
"000000000363",2,1,"Load","Stovepipe hats, lobsters and hot dog buns",1776.98,"","","Mitchell O'Toole",""
"000000000363",3,1,"Unload","Velvet and ice cream cones",976.38,"","","Janice Harrison",""
"000000000363",4,1,"Drop","Bricks and turtle eggs",7946.47,"759471186184","491759682805","Oliver Lewis",""
"000000000363",5,1,"Drop","Potatoes, gold and uranium",2040.23,"476308219795","5858197321","Velma Irvin",""
"000000000363",6,1,"Unload","stovepipe hats",3218.93,"257634495511","510857167506","Charles Irvin",""
"000000000364",2,1,"Hook","turtle eggs",8994.58,"725866611776","417984594328","Charles R. Edwards",""
"000000000364",3,1,"Hook","Stovepipe hats and radium",706.9,"","989558881974","Isaiah Covington","Harriet N. French"
"000000000364",3,2,"Drop","flash-frozen french fries",6955.02,"476644137611","897570597263","Danielle H. Smith",""
"000000000364",4,1,"Hook","Krazy glue, hot dog buns, ice cream cones and velvet",4983.4,"195235472511","","Louise D. Lewis",""
"000000000364",5,1,"Unload","Flash-frozen french fries, bricks and uranium",766.53,"","479755372773","Alfred Underwood","Kevin O'Toole"
"000000000365",2,1,"Load","uranium",2253.61,"51604491296","265481556114","Oliver Xing",""
"000000000365",3,1,"Hook","Jogging pants, dogfood and ice cream cones",6320.25,"","","Danielle U. French",""
"000000000365",4,1,"Hook","X-ray machine parts and apples",1094.34,"160620227327","946091713661","Eduardo Perry",""
"000000000365",5,1,"Load","Orange juice and lobsters",2819.24,"110146062987","74211082460","George Perry-Nelson",""
"000000000365",6,1,"Load","Machinery, nylon stockings and Caesar salad mix",6997.08,"108775910973","465188277025","Mitchell Grimes Kern",""
"000000000365",7,1,"Hook","Windows and hot dog buns",1522.91,"","949696838437","Velma L. Lewis",""
"000000000365",8,1,"Unload","Uranium and lobsters",7402.78,"423399056834","884088107583","Charles Thompson Kern",""
"000000000365",9,1,"Load","Yoyos and jogging pants",4860.29,"","","Kevin E. Thompson",""
"000000000365",9,2,"Drop","radium",7881.04,"","111714357825","Charles Edwards",""
"000000000365",10,1,"Drop","Lobsters, stovepipe hats and quilts",5199.51,"154776463783","53878368146","Harriet O. Kern",""
"000000000366",2,1,"Load","Uranium, Caesar salad mix and windows",3982.98,"507301190630","342847972976","Alfred H. Williams O'Toole",""
"000000000366",4,1,"Load","Yoyos, Caesar salad mix and orange juice",4424.64,"997995791727","","Nancy L. Ramakrishnan",""
"000000000366",5,1,"Unload","Quilts and potatoes",7879.78,"272521838925","597629498954","Yancey W. Benitez","Harriet Mitchell"
"000000000366",7,1,"Drop","Apples and machinery",1778.84,"","312280014077","Charles Xing","Harriet Nelson"
"000000000366",8,1,"Drop","x-ray machine parts",2168.5,"","866094578746","Alfred D. Anderson",""
"000000000366",9,1,"Hook","Windows, dogfood, engine parts and apples",8405.88,"","132214688599","Mitchell H. Lewis Grimes",""
"000000000366",9,2,"Drop","Quilts and machinery",1684.08,"","398852590597","Ulysses Benitez-O'Toole",""
"000000000366",10,1,"Drop","Dogfood and x-ray machine parts",5040.1,"","388052328934","Mitchell N. Yarbrough",""
"000000000366",12,1,"Unload","Jogging pants and windows",3480.05,"506415219035","412650996671","Ulysses Kern",""
"000000000367",2,1,"Hook","Turtle eggs and nylon stockings",8754.68,"","571344979366","Kevin N. Irvin",""
"000000000367",3,1,"Hook","quilts",1946.53,"","753058154371","George Irvin",""
"000000000367",3,2,"Drop","Turtle eggs and gold",6368.15,"650927068958","","William X. Irvin","William Benitez"
"000000000367",4,1,"Load","Caesar salad mix and velvet",7083.53,"","","Janice Ramakrishnan",""
"000000000367",4,2,"Drop","Bricks and windows",8755.65,"","","Mitchell T. Harrison","Samuel Smith"
"000000000367",5,1,"Hook","flash-frozen french fries",7307.6,"195179364075","440759608787","Charles Quasnoy",""
"000000000367",5,2,"Drop","velvet",7310.38,"","230295710117","Patricia V. Edwards",""
"000000000367",6,1,"Load","Orange juice, gold and ice cream cones",2299.1,"","","Quincy Xing-O'Toole",""
"000000000367",6,2,"Drop","Yoyos, uranium and ice cream cones",345.39,"","404399421732","Eduardo Lewis",""
"000000000367",7,1,"Hook","X-ray machine parts and gold",697.23,"","","Mitchell Lewis",""
"000000000367",8,1,"Hook","Dogfood, nylon stockings and uranium",9386,"","","Alfred O'Toole",""
"000000000367",8,2,"Unload","stovepipe hats",5097.05,"209317433741","","Alfred Q. Mitchell",""
"000000000367",9,1,"Unload","Dogfood and nylon stockings",7392.18,"","","Danielle Irvin",""
"000000000368",2,1,"Load","X-ray machine parts, quilts, flash-frozen french fries and hot dog buns",1598.13,"84119540880","686691208158","Harriet Grimes",""
"000000000368",4,1,"Hook","Uranium, apples and windows",9331.61,"566336491270","","Louise R. Kern","Janice L. Yarbrough"
"000000000368",6,1,"Load","Potatoes and dogfood",7677.73,"640502316","","Harriet Irvin",""
"000000000368",9,1,"Unload","velvet",2989.25,"650577127704","156087856404","Harriet V. Jackson",""
"000000000369",2,1,"Hook","jogging pants",2802.84,"351994148892","129045065102","Betty G. Williams",""
"000000000369",3,1,"Hook","Quilts, hot dog buns and ice cream cones",4989.46,"","","Harriet Grimes-Nelson","Danielle Anderson"
"000000000369",3,2,"Unload","Flash-frozen french fries, krazy glue, x-ray machine parts and lobsters",324.4,"562712861195","321084571243","Xaviera Perry",""
"000000000369",5,1,"Load","Machinery, flash-frozen french fries, engine parts and krazy glue",9501.07,"376868950695","","Francis M. Perry-O'Toole",""
"000000000369",5,2,"Drop","Jogging pants, apples, flash-frozen french fries and yoyos",4505.28,"","937248597680","Charles Irvin",""
"000000000369",6,1,"Unload","potatoes",6689.31,"225978332109","909639893056","Roberta Xing Mitchell","George Thompson"
"000000000370",2,1,"Load","Uranium and yoyos",7864.19,"804028597342","732631161712","Louise Yarbrough",""
"000000000370",3,1,"Hook","Apples, dogfood, radium and jogging pants",9929.39,"694362252017","37853086460","William L. Edwards","Francis U. Williams"
"000000000370",3,2,"Unload","Windows and bricks",9422.87,"396244770768","","Louise T. Williams",""
"000000000370",4,1,"Unload","orange juice",4632.71,"","","Roberta Velazquez",""
"000000000370",6,1,"Hook","Krazy glue, nylon stockings, apples and jogging pants",2701.38,"","880257434499","William Edwards",""
"000000000370",6,2,"Drop","Engine parts, potatoes and uranium",7113.94,"385535739858","130003017028","George H. Ramakrishnan",""
"000000000370",7,1,"Hook","yoyos",8798.77,"","767384183818","Ulysses Harrison",""
"000000000370",7,2,"Drop","krazy glue",8419.43,"","23368687746","Nancy Velazquez Thompson",""
"000000000370",8,1,"Unload","Machinery, radium, orange juice and lobsters",9091.47,"405708283203","74169356790","Betty Harrison",""
"000000000371",2,1,"Hook","krazy glue",3886.51,"","548719203370","Kevin A. Thompson",""
"000000000371",3,1,"Hook","Dogfood, Caesar salad mix, krazy glue and orange juice",108.18,"114734680239","128528609559","Alfred Mitchell",""
"000000000371",3,2,"Drop","Radium, engine parts and gold",512.66,"11412881373","843624934791","Alfred S. Kern-Williams",""
"000000000371",4,1,"Hook","Velvet and turtle eggs",9338.9,"492178212273","","Janice Perry",""
"000000000371",5,1,"Load","jogging pants",9418.88,"802037164384","72995112967","Danielle U. Ramakrishnan",""
"000000000371",5,2,"Unload","x-ray machine parts",6000.13,"618702531338","","Roberta Kern",""
"000000000371",6,1,"Load","Caesar salad mix and dogfood",7863.43,"","363318560633","Eduardo Quasnoy",""
"000000000371",6,2,"Unload","Jogging pants, turtle eggs and windows",8564.22,"","571466191636","Oliver Irvin",""
"000000000371",7,1,"Unload","Lobsters and machinery",4235.89,"500031750426","744828489282","Danielle B. Covington",""
"000000000372",2,1,"Hook","Machinery and hot dog buns",1611.68,"724496831230","131004196347","Danielle I. Mitchell","George Yarbrough"
"000000000372",4,1,"Hook","Velvet, nylon stockings, turtle eggs and radium",9594.23,"","","Mitchell X. Irvin French",""
"000000000372",6,1,"Drop","lobsters",3321.65,"250510604238","","Charles L. Velazquez",""
"000000000373",2,1,"Load","ice cream cones",6972.71,"284148072733","578591010108","Alfred B. French",""
"000000000373",3,1,"Drop","Uranium, ice cream cones and krazy glue",9329.25,"717111318800","307519397965","Quincy Underwood-Jackson",""
"000000000373",4,1,"Drop","Uranium, flash-frozen french fries and lobsters",3890.71,"","","Roberta Xing-Harrison",""
"000000000373",5,1,"Drop","Hot dog buns and gold",7732.95,"950928976922","","Harriet Quasnoy",""
"000000000374",2,1,"Load","Engine parts, windows, hot dog buns and nylon stockings",1457.49,"973689513806","805367302556","Oliver E. Underwood","William Benitez"
"000000000374",4,1,"Load","Ice cream cones and orange juice",4982.99,"129873806895","541829945276","Charles U. Yarbrough",""
"000000000374",5,1,"Hook","Yoyos, radium, jogging pants and ice cream cones",4913.69,"","","Isaiah Harrison",""
"000000000374",5,2,"Drop","Machinery, yoyos and krazy glue",1313.26,"716960172018","","William D. Perry",""
"000000000374",6,1,"Hook","Engine parts, nylon stockings and machinery",7131.63,"","920132716842","Francis Xing",""
"000000000374",7,1,"Drop","Jogging pants, orange juice, stovepipe hats and apples",372.78,"","217116968457","Louise U. Underwood-Williams",""
"000000000375",2,1,"Hook","Bricks, machinery and gold",8365.56,"","","Isaiah Edwards",""
"000000000375",3,1,"Load","x-ray machine parts",9641.59,"","891015379185","Oliver N. Mitchell","Janice R. Quasnoy"
"000000000375",4,1,"Drop","Yoyos and dogfood",8029.71,"849567921102","238758528872","Francis U. Smith",""
"000000000375",5,1,"Drop","Dogfood, hot dog buns, nylon stockings and engine parts",2327.92,"","","Yancey Perry-Williams",""
"000000000375",6,1,"Load","Bricks, x-ray machine parts and windows",8113.94,"983876688760","462050377021","Nancy W. Dawson",""
"000000000375",7,1,"Unload","engine parts",5173.07,"333580159223","367335933873","Alfred R. Irvin",""
"000000000375",8,1,"Drop","Hot dog buns, x-ray machine parts and uranium",2957.29,"145194810195","721721106098","Danielle J. Yarbrough",""
"000000000375",9,1,"Drop","Flash-frozen french fries, hot dog buns and Caesar salad mix",9930.33,"","233919433002","George Kern Irvin",""
"000000000376",2,1,"Load","Jogging pants, stovepipe hats and engine parts",338.8,"","862031782062","Yancey T. French",""
"000000000376",3,1,"Hook","Bricks and Caesar salad mix",7301.83,"","432944629219","Francis Mitchell",""
"000000000376",3,2,"Drop","stovepipe hats",8428.59,"401373363622","","George Williams",""
"000000000376",4,1,"Drop","Engine parts, stovepipe hats and orange juice",1423.57,"809466832267","199836246621","Yancey M. Xing","William Perry"
"000000000376",8,1,"Load","Potatoes, dogfood, velvet and gold",2626.16,"388791942173","","Janice S. Ramakrishnan",""
"000000000376",8,2,"Unload","Hot dog buns, nylon stockings and x-ray machine parts",4854.65,"597505260492","84601310745","Quincy F. Kern",""
"000000000376",10,1,"Hook","Yoyos, turtle eggs, jogging pants and bricks",7738.13,"33093465586","804538122969","Roberta Mitchell","Janice H. Velazquez-Jackson"
"000000000376",10,2,"Unload","Caesar salad mix",2412.26,"","822156155698","Roberta P. Smith","Charles Thompson Underwood"
"000000000376",11,1,"Hook","yoyos",319.68,"264284611038","580410713974","Tammy Mitchell","Francis Smith"
"000000000376",12,1,"Drop","Turtle eggs, radium and quilts",6355.03,"994206140487","69632411645","Mitchell Anderson",""
"000000000377",2,1,"Load","Orange juice and dogfood",4493.82,"187418923606","882296241919","Xaviera Williams",""
"000000000377",3,1,"Hook","radium",9399.97,"438990757828","69362571059","Eduardo Harrison Kern",""
"000000000377",4,1,"Load","hot dog buns",1290.04,"551995156588","519343195192","Quincy Benitez",""
"000000000377",4,2,"Unload","Flash-frozen french fries, x-ray machine parts and Caesar salad mix",3463.6,"361967164441","266768907741","Nancy Xing",""
"000000000377",5,1,"Load","x-ray machine parts",4893.62,"","384315825701","Samuel Ramakrishnan-Anderson",""
"000000000377",5,2,"Drop","quilts",6777.44,"712426712318","769920619747","Francis Quasnoy-Smith",""
"000000000377",6,1,"Hook","Ice cream cones and hot dog buns",8654.96,"268407693523","553980302563","Roberta V. French-Ramakrishnan",""
"000000000377",9,1,"Load","Hot dog buns and nylon stockings",8845.99,"928156983547","353346759637","Danielle Perry-Smith",""
"000000000377",9,2,"Drop","machinery",9643.33,"426646454384","499089491051","Betty Q. French",""
"000000000377",10,1,"Hook","Gold, windows and yoyos",9886.68,"200846496725","","Kevin Edwards",""
"000000000377",10,2,"Unload","dogfood",5199.62,"","956344094013","Francis Smith",""
"000000000377",11,1,"Hook","Dogfood, machinery and apples",2829.31,"355752445037","","Charles D. Quasnoy",""
"000000000377",12,1,"Hook","Uranium, ice cream cones, nylon stockings and engine parts",7277.3,"","","Roberta E. Lewis-French",""
"000000000377",14,1,"Drop","Dogfood and gold",2520.41,"","80776909369","Janice Thompson-Mitchell",""
"000000000378",2,1,"Hook","Quilts, machinery and radium",3278.92,"","811116762781","Alfred Thompson",""
"000000000378",5,1,"Load","stovepipe hats",4438.49,"354983073355","644030005318","Roberta Covington",""
"000000000378",6,1,"Hook","Nylon stockings and gold",6910.89,"640396929339","","Eduardo Anderson",""
"000000000378",6,2,"Unload","engine parts",389.81,"339674887236","","Xaviera Irvin Xing",""
"000000000378",7,1,"Unload","Potatoes, yoyos and krazy glue",5423.27,"969048996936","","Samuel R. Smith","Roberta Jackson-Quasnoy"
"000000000379",2,1,"Load","Radium, yoyos, turtle eggs and gold",1146.83,"","","Xaviera Perry-French",""
"000000000379",3,1,"Load","Uranium and machinery",8293.55,"","","Kevin Kern",""
"000000000379",3,2,"Unload","Dogfood, uranium and gold",4667.16,"976656980590","657951673779","George Irvin",""
"000000000379",4,1,"Load","Dogfood, yoyos and gold",6793.22,"428132843097","994202358973","Eduardo Ramakrishnan",""
"000000000379",4,2,"Unload","Stovepipe hats, machinery and orange juice",4586.13,"418030505359","687759769604","Quincy C. Perry",""
"000000000379",5,1,"Unload","velvet",5334.87,"435108674207","","Alfred B. Anderson",""
"000000000379",6,1,"Drop","Hot dog buns, potatoes and jogging pants",4051.3,"","100932338325","Mitchell N. Irvin",""
"000000000380",2,1,"Load","Caesar salad mix, velvet, windows and quilts",334.81,"418557586935","706372184136","Betty W. Underwood","Alfred Mitchell"
"000000000380",3,1,"Unload","Lobsters, yoyos and radium",5803.8,"212612244143","","Kevin B. Xing-French",""
"000000000380",4,1,"Load","Bricks and jogging pants",5823.91,"468028728139","328510531950","Tammy Xing",""
"000000000380",4,2,"Drop","Yoyos and bricks",8159.6,"603524722891","543906681115","Roberta P. Jackson",""
"000000000380",5,1,"Hook","Caesar salad mix and flash-frozen french fries",5976,"882514351821","248830466556","Roberta Smith",""
