OrderId,StopSequenceNumber,CargoChangeSequenceNumber,CargoChangeType,GeneralDescription,Weight,TruckNumber,TrailerNumber,Driver1Name,Driver2Name
"000000000254",9,1,"Unload","Bricks, engine parts, potatoes and windows",7132.97,"","","Quincy Kern",""
"000000000255",2,1,"Hook","Krazy glue and yoyos",8866.49,"","","Kevin Dawson",""
"000000000255",3,1,"Drop","Nylon stockings and radium",7020.97,"698059037564","196639173956","Alfred Dawson",""
"000000000255",4,1,"Drop","krazy glue",833.8,"","666648403718","Oliver Underwood-Yarbrough",""
"000000000255",5,1,"Hook","potatoes",3443.13,"199266848775","542603818168","Oliver Smith",""
"000000000255",5,2,"Drop","Nylon stockings, machinery and gold",7422.01,"","101867222419","Janice Ramakrishnan",""
"000000000255",7,1,"Hook","Bricks, quilts, radium and engine parts",6068.66,"598119559849","469809772369","Nancy I. French-Velazquez",""
"000000000255",7,2,"Drop","krazy glue",9540.19,"315661659241","481105823781","Eduardo Grimes-O'Toole",""
"000000000255",8,1,"Load","Windows, turtle eggs and nylon stockings",4849.13,"","","Velma Perry",""
"000000000255",8,2,"Drop","lobsters",6230.33,"86794124284","","Mitchell Quasnoy",""
"000000000255",9,1,"Unload","Flash-frozen french fries and apples",1599.12,"149004649319","","Oliver Xing",""
"000000000255",10,1,"Unload","Jogging pants, yoyos and quilts",7424.98,"844175536583","","Charles R. Smith Velazquez",""
"000000000255",12,1,"Drop","Lobsters and krazy glue",7763.02,"957759717392","","Nancy Irvin",""
"000000000256",2,1,"Hook","ice cream cones",7176.6,"444938433738","","William J. Yarbrough",""
"000000000256",4,1,"Drop","Jogging pants, dogfood and turtle eggs",3542.73,"","922111084511","Quincy Anderson",""
"000000000256",5,1,"Hook","Orange juice, yoyos, hot dog buns and jogging pants",5610.93,"","","George L. French-O'Toole",""
"000000000256",5,2,"Unload","Quilts, turtle eggs, flash-frozen french fries and radium",4951.73,"973151199724","","Samuel G. Quasnoy",""
"000000000256",6,1,"Drop","Stovepipe hats, uranium, Caesar salad mix and flash-frozen french fries",9275.18,"","194925247576","Isaiah M. Edwards",""
"000000000256",7,1,"Hook","Gold, flash-frozen french fries and velvet",1356.25,"","332323349945","Ulysses Williams",""
"000000000256",8,1,"Load","ice cream cones",2586.82,"","463425221479","George O. Thompson",""
"000000000256",9,1,"Drop","Ice cream cones, engine parts and uranium",7155.35,"87250883510","771880880954","Tammy M. Kern",""
"000000000256",10,1,"Hook","Turtle eggs, krazy glue and engine parts",5120.41,"","38555509504","Janice I. Edwards",""
"000000000256",11,1,"Drop","Quilts and jogging pants",1801.31,"829621057837","","Ulysses S. Harrison Edwards",""
"000000000257",2,1,"Load","lobsters",2218.56,"403797159851","","Betty Y. Covington",""
"000000000257",3,1,"Hook","Orange juice, uranium and velvet",9813.93,"765396870106","753919163930","Velma Covington",""
"000000000257",3,2,"Drop","Potatoes, nylon stockings, flash-frozen french fries and bricks",8023.22,"","","Danielle A. Smith",""
"000000000257",4,1,"Unload","Orange juice, dogfood, Caesar salad mix and jogging pants",6808.08,"","232878851093","Quincy Benitez-Harrison",""
"000000000257",7,1,"Load","krazy glue",3209.52,"978225324501","609230211248","Samuel Grimes",""
"000000000257",7,2,"Unload","Windows, dogfood, engine parts and hot dog buns",2072.5,"59771113290","953297715163","Betty Lewis",""
"000000000257",9,1,"Drop","Bricks, radium and Caesar salad mix",2593.71,"804143219328","65674529392","William Benitez",""
"000000000258",2,1,"Load","Turtle eggs, apples and uranium",2713.4,"","219213556871","Xaviera O'Toole",""
"000000000258",5,1,"Unload","potatoes",7846.92,"128706828122","","Danielle A. Underwood",""
"000000000258",6,1,"Drop","Ice cream cones and jogging pants",1071.14,"901290685779","264429360375","Yancey Kern",""
"000000000258",10,1,"Unload","Apples, engine parts and hot dog buns",3155.99,"","484307696064","Nancy Thompson",""
"000000000259",2,1,"Hook","Apples and yoyos",5256.07,"315084115857","","Ulysses Edwards",""
"000000000259",3,1,"Load","dogfood",2974.48,"79930035532","145686264046","Francis Underwood-Edwards",""
"000000000259",4,1,"Hook","Ice cream cones and stovepipe hats",3973.19,"","983914232070","Charles W. Anderson Smith",""
"000000000259",5,1,"Unload","X-ray machine parts and nylon stockings",5010.59,"468704912014","597763532558","Danielle Kern",""
"000000000259",8,1,"Unload","Potatoes, orange juice, quilts and gold",6911.08,"199971175126","872694475644","Samuel B. Underwood-Mitchell",""
"000000000260",2,1,"Hook","Engine parts and lobsters",6115.24,"","501284949437","Louise Edwards",""
"000000000260",3,1,"Load","Yoyos, krazy glue and flash-frozen french fries",7531.37,"","36007254689","William V. Smith",""
"000000000260",3,2,"Drop","Gold and bricks",3462.66,"62098358595","6843250989","George Benitez",""
"000000000260",4,1,"Hook","Apples, dogfood and gold",6153.07,"917496599486","114091053249","Francis Anderson",""
"000000000260",4,2,"Unload","hot dog buns",1504.64,"","394270267049","Danielle V. Edwards",""
"000000000260",5,1,"Hook","Machinery and potatoes",6005.75,"829724068750","695213045275","Charles Williams-Perry","Ulysses D. Kern"
"000000000260",5,2,"Unload","Ice cream cones, lobsters, bricks and windows",6626.86,"19217559191","332920007432","Betty P. O'Toole-Covington",""
"000000000260",6,1,"Drop","Velvet, engine parts and bricks",2868.21,"","","Isaiah B. Grimes",""
"000000000261",2,1,"Hook","Lobsters, x-ray machine parts, jogging pants and krazy glue",640.52,"603765588668","57384736062","Oliver Kern",""
"000000000261",3,1,"Load","apples",2850.77,"","91486502014","Danielle Benitez",""
"000000000261",3,2,"Drop","apples",3855.71,"556953694906","886061733847","Patricia Velazquez-Thompson",""
"000000000261",4,1,"Hook","Jogging pants, stovepipe hats and turtle eggs",2537,"850113574984","","Patricia B. O'Toole",""
"000000000261",4,2,"Drop","Turtle eggs, flash-frozen french fries, stovepipe hats and yoyos",3459.65,"","310538187913","Kevin I. Ramakrishnan","Mitchell Y. Perry"
"000000000261",6,1,"Hook","Gold, uranium and jogging pants",912.17,"355875542055","941940695123","Kevin Thompson",""
"000000000261",6,2,"Unload","Caesar salad mix, gold and stovepipe hats",7802.33,"432425346461","805170243081","Velma J. Xing",""
"000000000261",7,1,"Load","Flash-frozen french fries and nylon stockings",5041.18,"","","Janice French Nelson",""
"000000000261",8,1,"Load","turtle eggs",9126.1,"","98276816036","Louise Smith-Covington",""
"000000000261",9,1,"Load","Bricks, flash-frozen french fries and quilts",3644.59,"293652266522","990531264362","Eduardo O'Toole",""
"000000000261",10,1,"Load","Bricks, windows, velvet and yoyos",3285.86,"447546657840","418850024373","Oliver Velazquez","Patricia Benitez"
"000000000261",10,2,"Unload","Flash-frozen french fries, uranium and windows",525.63,"232810993856","","Kevin Nelson",""
"000000000261",11,1,"Hook","Jogging pants and apples",7821.78,"871691942995","385014073694","Betty French",""
"000000000261",11,2,"Unload","Nylon stockings and orange juice",6573.96,"707729932242","627265153338","Tammy Williams",""
"000000000261",12,1,"Hook","Dogfood, ice cream cones and orange juice",344.96,"","986081774635","Isaiah K. Mitchell",""
"000000000261",13,1,"Unload","Nylon stockings, dogfood, stovepipe hats and yoyos",1616.26,"276583201239","677225026919","Kevin S. Yarbrough",""
"000000000262",2,1,"Load","Uranium, flash-frozen french fries, quilts and machinery",9249.01,"389890577962","83878475633","Samuel O'Toole","Alfred Yarbrough"
"000000000262",3,1,"Hook","Krazy glue, jogging pants and potatoes",1389.85,"324060193359","335612401770","Samuel Q. Perry","Kevin Velazquez-Underwood"
"000000000262",4,1,"Hook","krazy glue",6734.18,"550811415848","939431151529","William R. Irvin-Smith",""
"000000000262",5,1,"Drop","Yoyos and krazy glue",8139.57,"","","Kevin Quasnoy",""
"000000000262",6,1,"Unload","machinery",1396.65,"","484802651112","Xaviera I. Jackson",""
"000000000262",7,1,"Hook","Lobsters and engine parts",7116.18,"107115631879","378784102088","Betty Anderson",""
"000000000262",8,1,"Hook","lobsters",3593.38,"","","Francis Lewis",""
"000000000262",9,1,"Drop","Nylon stockings, radium and lobsters",4744.1,"","","Nancy Edwards",""
"000000000262",10,1,"Load","Hot dog buns and dogfood",9074.86,"61465217108","511057597378","Samuel Dawson",""
"000000000262",11,1,"Unload","Windows and orange juice",5817.85,"30312609406","","Danielle Williams","Yancey Yarbrough-Ramakrishnan"
"000000000262",12,1,"Unload","jogging pants",9644.38,"904685245158","689521448","Danielle Benitez",""
"000000000263",2,1,"Hook","Ice cream cones, hot dog buns, x-ray machine parts and apples",2508.47,"514055131190","324403302295","Janice F. Covington-Smith",""
"000000000263",5,1,"Unload","Ice cream cones, Caesar salad mix, x-ray machine parts and velvet",3947.85,"","","Eduardo J. Perry","Xaviera L. Benitez"
"000000000264",2,1,"Load","Apples, potatoes, machinery and gold",7493.73,"88610904954","","Francis Mitchell",""
"000000000264",3,1,"Hook","nylon stockings",783.63,"538299980066","692723103219","Betty Nelson",""
"000000000264",4,1,"Hook","windows",4632.2,"285079537537","","Louise Jackson",""
"000000000264",5,1,"Hook","Flash-frozen french fries, orange juice and Caesar salad mix",9649.05,"453935451880","349575450441","Oliver Mitchell",""
"000000000264",6,1,"Unload","velvet",3740.18,"496957689337","","Betty Thompson","Patricia Velazquez"
"000000000265",2,1,"Load","Windows, quilts and dogfood",1305.02,"","181275827671","Eduardo Lewis",""
"000000000265",3,1,"Hook","Uranium, apples, orange juice and potatoes",8833.46,"736440969285","748137160137","George Kern",""
"000000000265",4,1,"Hook","Velvet, machinery, potatoes and lobsters",637.8,"420010223482","","Ulysses Dawson Yarbrough",""
"000000000265",8,1,"Load","Potatoes, radium and quilts",758.42,"94826083533","","Francis Quasnoy-Ramakrishnan","Yancey Covington"
"000000000265",8,2,"Drop","Jogging pants, yoyos, flash-frozen french fries and ice cream cones",5244.31,"298322794520","193598884657","Quincy Underwood",""
"000000000265",9,1,"Hook","Velvet, krazy glue and flash-frozen french fries",4993.6,"250172112170","995996600895","Xaviera I. Yarbrough","Mitchell A. Velazquez"
"000000000265",10,1,"Hook","machinery",6459.54,"","929355725917","Tammy Underwood",""
"000000000265",12,1,"Hook","stovepipe hats",7520.25,"509986178679","","Janice Benitez",""
"000000000265",12,2,"Unload","Bricks, lobsters and hot dog buns",365.74,"","","Velma R. Smith",""
"000000000265",13,1,"Load","nylon stockings",2672.63,"683822392974","593563283827","Isaiah Ramakrishnan",""
"000000000265",14,1,"Load","flash-frozen french fries",2422.72,"","481281624351","Louise M. Covington",""
"000000000265",14,2,"Unload","Quilts, Caesar salad mix and windows",1709.43,"948167081720","","Janice W. Benitez",""
"000000000265",16,1,"Drop","Dogfood, yoyos and orange juice",1851.65,"","517964039398","Tammy G. Lewis",""
"000000000266",2,1,"Load","Caesar salad mix",5294.51,"593281821539","","Charles Irvin",""
"000000000266",3,1,"Drop","Flash-frozen french fries, x-ray machine parts, hot dog buns and krazy glue",7138.09,"","372919294247","Mitchell G. Grimes",""
"000000000266",4,1,"Hook","Dogfood and flash-frozen french fries",9779.7,"","785803148625","Patricia Dawson",""
"000000000266",5,1,"Hook","Caesar salad mix, stovepipe hats, velvet and uranium",3627.12,"165953644267","22103420880","Ulysses I. Quasnoy-Perry",""
"000000000266",6,1,"Drop","windows",4797.38,"","378793312776","Xaviera T. Underwood-Velazquez",""
"000000000266",7,1,"Drop","Quilts and Caesar salad mix",3702.83,"878105725632","","Roberta Anderson",""
"000000000267",2,1,"Hook","Engine parts, machinery, krazy glue and windows",7688.3,"327423087944","255242093557","Mitchell D. Yarbrough",""
"000000000267",3,1,"Drop","uranium",4567.65,"257910143634","","Quincy L. Anderson",""
"000000000267",4,1,"Load","Caesar salad mix and ice cream cones",1582.89,"817972024900","332024211218","Tammy Nelson",""
"000000000267",4,2,"Unload","nylon stockings",8135.83,"","","Francis T. Lewis-Smith",""
"000000000267",5,1,"Load","Machinery and Caesar salad mix",2544.15,"771050283931","833053125536","Janice Nelson-Mitchell",""
"000000000267",5,2,"Unload","Bricks and potatoes",6260.32,"240897617189","628951090583","Eduardo French",""
"000000000267",6,1,"Drop","radium",3430.44,"330880021668","206417499056","Tammy Edwards",""
"000000000267",7,1,"Unload","hot dog buns",8285.69,"382822430416","","Mitchell W. Jackson",""
"000000000268",2,1,"Load","Orange juice, nylon stockings and krazy glue",7236.78,"108456693201","","Louise Jackson",""
"000000000268",3,1,"Unload","Turtle eggs and velvet",5530.64,"517472384708","","Alfred W. Dawson",""
"000000000268",4,1,"Hook","Jogging pants and krazy glue",1633.39,"","","Mitchell Nelson",""
"000000000268",5,1,"Load","Lobsters, radium and yoyos",8656.99,"731753183696","","Quincy Underwood",""
"000000000268",6,1,"Hook","Flash-frozen french fries and potatoes",6530.9,"972924399795","","Samuel Q. Lewis",""
"000000000268",6,2,"Unload","Caesar salad mix and krazy glue",2623.42,"396741882517","889402025790","Kevin Irvin",""
"000000000268",7,1,"Drop","Caesar salad mix, bricks and jogging pants",9749.06,"","5838505594","Velma W. Irvin",""
"000000000268",8,1,"Load","Radium, apples, turtle eggs and bricks",7806.28,"","","Yancey O. Perry",""
"000000000268",9,1,"Unload","Caesar salad mix, yoyos, hot dog buns and orange juice",9620.35,"325654217506","117456014403","Harriet Kern-Lewis",""
"000000000268",10,1,"Drop","Dogfood, stovepipe hats, flash-frozen french fries and jogging pants",7505.45,"19373031707","","Isaiah Ramakrishnan-Benitez",""
"000000000269",2,1,"Load","Quilts, orange juice and radium",5937.43,"178646186061","287187949528","Nancy Underwood",""
"000000000269",5,1,"Hook","turtle eggs",7370.13,"856733316926","734014454084","Patricia Yarbrough",""
"000000000269",7,1,"Hook","ice cream cones",6126.96,"770347406725","196986105694","Nancy L. Lewis Irvin",""
"000000000269",8,1,"Hook","Lobsters, machinery, ice cream cones and windows",4330.74,"","","Louise Jackson-Thompson","Yancey T. Nelson Williams"
"000000000269",8,2,"Drop","Flash-frozen french fries, radium and x-ray machine parts",2330.15,"334556055228","841208660865","Harriet Lewis",""
"000000000269",9,1,"Unload","Quilts, jogging pants and stovepipe hats",5981.35,"272307401138","744375423258","Eduardo Anderson",""
"000000000269",10,1,"Hook","Velvet and machinery",2078.84,"","","Nancy Yarbrough",""
"000000000269",10,2,"Drop","Orange juice, apples, yoyos and machinery",5632,"354385717839","","Harriet Benitez",""
"000000000269",11,1,"Hook","Stovepipe hats, lobsters, velvet and jogging pants",3247.1,"423267706052","859113174723","Samuel Lewis",""
"000000000269",11,2,"Unload","Potatoes and machinery",4788.25,"820405105307","512295235354","Charles Yarbrough-Irvin",""
"000000000269",13,1,"Unload","Caesar salad mix, jogging pants, yoyos and stovepipe hats",7275.25,"379081609203","155047851872","Betty Dawson","Isaiah Mitchell"
"000000000269",14,1,"Unload","Windows, machinery and nylon stockings",1528.82,"826127758102","520751791793","Xaviera Jackson",""
"000000000270",2,1,"Load","hot dog buns",8975.05,"556568953233","","Patricia Benitez",""
"000000000270",3,1,"Drop","Jogging pants and dogfood",8784.9,"","565007353184","Xaviera Q. Thompson",""
"000000000270",4,1,"Hook","Stovepipe hats and radium",1557.37,"151439291253","340487169487","George Y. Nelson",""
"000000000270",5,1,"Hook","Radium, uranium, flash-frozen french fries and engine parts",7473.92,"856273241667","822490604282","Janice Jackson",""
"000000000270",6,1,"Load","Turtle eggs and machinery",5495.65,"298747299207","121458477909","Eduardo I. Lewis-Velazquez",""
"000000000270",7,1,"Hook","Yoyos, turtle eggs, flash-frozen french fries and uranium",7218.8,"776316717345","935360987478","Patricia Ramakrishnan","Alfred O. Benitez"
"000000000270",8,1,"Unload","Machinery, x-ray machine parts, bricks and Caesar salad mix",1890.36,"444601181260","","Kevin Nelson",""
"000000000271",2,1,"Load","dogfood",8336.18,"256251019615","","Xaviera H. Nelson",""
"000000000271",3,1,"Load","Flash-frozen french fries and apples",9584.94,"559139157959","173571078218","Velma Underwood",""
"000000000271",3,2,"Drop","Gold, uranium, turtle eggs and lobsters",6389.42,"","386819192057","Oliver G. Harrison-Benitez",""
"000000000271",5,1,"Drop","potatoes",2542.85,"792339013890","802081494796","Tammy Velazquez",""
"000000000271",6,1,"Unload","Nylon stockings, turtle eggs and potatoes",2473.1,"361733234116","221242367303","Harriet Grimes-Jackson",""
"000000000271",7,1,"Drop","Ice cream cones, krazy glue, windows and jogging pants",8637.84,"","","Betty Anderson",""
"000000000272",2,1,"Load","Krazy glue and lobsters",5726.42,"159186617238","","Isaiah Mitchell",""
"000000000272",3,1,"Load","X-ray machine parts, yoyos, machinery and lobsters",6642.34,"","862653357621","Patricia Ramakrishnan",""
"000000000272",4,1,"Hook","windows",923.47,"738711714577","51758992241","Francis B. Dawson",""
"000000000272",5,1,"Hook","Jogging pants and dogfood",7892.3,"998876850851","83654979263","Kevin Q. Lewis Underwood",""
"000000000272",7,1,"Hook","Velvet, hot dog buns and radium",1977.8,"607708440519","139029756057","Velma Covington",""
"000000000272",8,1,"Unload","radium",8107.02,"265906497645","","Janice Xing",""
"000000000273",2,1,"Hook","Yoyos and bricks",8269.33,"","585738605684","Yancey Covington",""
"000000000273",7,1,"Load","Dogfood, jogging pants and flash-frozen french fries",4085.41,"","173184159693","Mitchell Grimes",""
"000000000273",8,1,"Hook","Stovepipe hats, gold and flash-frozen french fries",8775.8,"945773858486","588349370188","Nancy Grimes","Quincy Irvin"
"000000000273",8,2,"Drop","X-ray machine parts and orange juice",7628.18,"283049982633","","Charles F. Velazquez",""
"000000000273",9,1,"Unload","Orange juice and apples",9415.75,"567458867402","","Oliver Dawson Irvin","Harriet X. Mitchell-Ramakrishnan"
"000000000274",2,1,"Hook","Machinery, dogfood, uranium and apples",2555.88,"","","Francis N. Edwards-Lewis",""
"000000000274",3,1,"Load","Jogging pants and hot dog buns",6712.88,"389278015473","160707219500","Alfred Ramakrishnan",""
"000000000274",4,1,"Load","Hot dog buns and quilts",7064.76,"75540146054","263883721741","Quincy O. Velazquez-Smith",""
"000000000274",6,1,"Hook","krazy glue",5254.49,"976340292380","818105884465","Quincy J. French",""
"000000000274",7,1,"Hook","windows",4573.82,"88719216623","59186048660","Charles E. Velazquez",""
"000000000274",8,1,"Hook","Engine parts, potatoes and jogging pants",1771.91,"","799820687427","William L. Irvin",""
"000000000274",8,2,"Drop","Orange juice, hot dog buns and krazy glue",6440.34,"","","Oliver J. Jackson-Edwards",""
"000000000274",10,1,"Drop","Gold, x-ray machine parts and radium",9949.85,"735890876327","","Charles Dawson",""
"000000000275",2,1,"Load","Lobsters and flash-frozen french fries",628.78,"","701666728309","Tammy F. Velazquez","Harriet O. Ramakrishnan"
"000000000275",4,1,"Hook","Stovepipe hats, potatoes and flash-frozen french fries",4278.16,"","","Harriet Mitchell-Yarbrough","Roberta Lewis-Jackson"
"000000000275",4,2,"Unload","Quilts, velvet, dogfood and Caesar salad mix",3621.85,"758785563966","502530205101","Quincy N. Grimes Underwood",""
"000000000275",5,1,"Hook","Quilts, hot dog buns and engine parts",2719,"","516567562597","Isaiah Harrison",""
"000000000275",6,1,"Load","Caesar salad mix, hot dog buns, bricks and velvet",5732.11,"324192352782","666804383550","Isaiah Edwards Yarbrough",""
"000000000275",6,2,"Unload","Bricks and yoyos",7237.11,"","247601537588","Yancey K. Underwood",""
"000000000275",7,1,"Drop","Quilts and ice cream cones",5511.44,"","304579485557","Tammy Smith French",""
"000000000275",8,1,"Hook","Lobsters and nylon stockings",9587.33,"426382689123","76510868207","Francis Dawson",""
"000000000275",8,2,"Unload","Yoyos, lobsters, x-ray machine parts and krazy glue",7941.13,"966153602220","159631102010","Velma F. Yarbrough",""
"000000000275",9,1,"Unload","Yoyos, velvet and stovepipe hats",1244.3,"764170600894","","Samuel B. Kern-Covington",""
"000000000276",2,1,"Load","Quilts, orange juice, x-ray machine parts and windows",9296.1,"116396511322","","Mitchell Nelson","Patricia O'Toole"
"000000000276",3,1,"Drop","X-ray machine parts, quilts and lobsters",7284.09,"","","Quincy S. Velazquez",""
"000000000276",4,1,"Unload","Dogfood, x-ray machine parts, nylon stockings and windows",3268.86,"307472390143","952035288484","Ulysses R. Smith-Grimes",""
"000000000277",2,1,"Hook","lobsters",8054.44,"230985123108","320899406876","Tammy Ramakrishnan",""
"000000000277",4,1,"Drop","Flash-frozen french fries, potatoes and jogging pants",5817.18,"339615194769","480852278640","Harriet J. Smith",""
"000000000278",2,1,"Load","Jogging pants, radium and nylon stockings",6053.34,"","959611413655","Samuel Irvin",""
"000000000278",3,1,"Drop","Dogfood, windows and engine parts",1019.57,"139396879895","103157094883","Oliver Nelson",""
"000000000278",4,1,"Unload","Radium, turtle eggs, x-ray machine parts and krazy glue",4829.4,"","19992613426","Janice Benitez",""
"000000000278",5,1,"Hook","Uranium and x-ray machine parts",3201.43,"200211811762","784777508894","Quincy D. Lewis Velazquez",""
"000000000278",6,1,"Hook","Nylon stockings and yoyos",1099.16,"","632118996544","Tammy I. Dawson-Quasnoy",""
"000000000278",7,1,"Unload","Ice cream cones and jogging pants",1270.11,"797302995672","816118134478","Kevin Dawson",""
"000000000278",8,1,"Drop","Windows, radium, hot dog buns and dogfood",7141.61,"","378965416645","Harriet J. Nelson","Charles U. Mitchell"
"000000000279",2,1,"Hook","jogging pants",6712.62,"858604563483","756091411868","Harriet Ramakrishnan",""
"000000000279",3,1,"Hook","potatoes",9279.37,"79169153236","946354622633","Yancey Kern","Yancey V. Ramakrishnan Dawson"
"000000000279",3,2,"Unload","Caesar salad mix",3425.47,"277192295857","819264489752","Oliver Grimes",""
"000000000279",4,1,"Drop","Ice cream cones, uranium and bricks",7805.92,"859682318616","","Tammy Harrison-Mitchell","Kevin A. French"
"000000000279",5,1,"Load","Krazy glue, jogging pants, stovepipe hats and uranium",6073.32,"385517600155","560125347586","Francis R. Ramakrishnan",""
"000000000279",6,1,"Drop","Quilts and krazy glue",2224.49,"","","Louise Harrison",""
"000000000279",7,1,"Load","Bricks and velvet",1292.15,"","965956382567","Quincy B. Nelson",""
"000000000279",8,1,"Drop","Uranium and krazy glue",9477.04,"289973724500","","Nancy W. Quasnoy",""
"000000000279",9,1,"Unload","Orange juice, yoyos and jogging pants",6438.38,"236355351072","","George I. Yarbrough O'Toole",""
"000000000280",2,1,"Load","nylon stockings",3398.21,"","555693363614","Danielle T. Xing",""
"000000000280",3,1,"Hook","Flash-frozen french fries and gold",3208.18,"496623683189","","Patricia Yarbrough",""
"000000000280",4,1,"Hook","Machinery and ice cream cones",1879.83,"410621478402","","Isaiah Ramakrishnan",""
"000000000280",5,1,"Load","Flash-frozen french fries and turtle eggs",3840.17,"","26174627741","Roberta T. Irvin",""
"000000000280",6,1,"Load","X-ray machine parts, yoyos and krazy glue",8601.03,"73829531998","","Roberta T. Irvin","Mitchell X. Irvin"
"000000000280",7,1,"Load","uranium",251.69,"","56562352247","Betty D. Benitez Edwards",""
"000000000280",8,1,"Drop","Yoyos, machinery, flash-frozen french fries and lobsters",1626.03,"399653224763","","Patricia Velazquez",""
"000000000281",2,1,"Hook","engine parts",3434.02,"70757773536","938014146811","Oliver A. O'Toole","Danielle U. French"
"000000000281",3,1,"Load","krazy glue",332.47,"581243870191","494725442288","Charles N. Jackson",""
"000000000281",5,1,"Hook","Flash-frozen french fries, nylon stockings and potatoes",6443.61,"605556707774","3981215491","Samuel E. Velazquez",""
"000000000281",6,1,"Load","Bricks and lobsters",8631.54,"","","Kevin Thompson",""
"000000000281",6,2,"Drop","X-ray machine parts and radium",2305.13,"208206006888","37228739916","Ulysses French",""
"000000000281",7,1,"Drop","Jogging pants, engine parts, windows and x-ray machine parts",2298.58,"463379955935","","Oliver D. Edwards",""
"000000000281",8,1,"Hook","Windows, radium, stovepipe hats and ice cream cones",3884.99,"715778885730","728277798535","Harriet O'Toole",""
"000000000281",9,1,"Load","Hot dog buns and quilts",7512.69,"560777697059","786373184587","Kevin S. French","Mitchell Quasnoy"
"000000000281",9,2,"Unload","Quilts, stovepipe hats and yoyos",4378.63,"","528123013111","Patricia H. Grimes","Isaiah K. Edwards O'Toole"
"000000000281",10,1,"Unload","Krazy glue, Caesar salad mix and stovepipe hats",1577.48,"621830621572","","Xaviera U. Perry",""
"000000000282",2,1,"Load","Uranium, machinery, stovepipe hats and quilts",5620.1,"","2562940768","Samuel Q. Dawson",""
"000000000282",3,1,"Load","Uranium, nylon stockings, bricks and stovepipe hats",9581.69,"792872677099","708656519566","Samuel Covington",""
"000000000282",4,1,"Drop","gold",936.72,"","","Louise Nelson Dawson","Patricia G. Grimes"
"000000000283",2,1,"Load","Flash-frozen french fries, stovepipe hats and jogging pants",6073.9,"11231287090","","Oliver V. Dawson",""
"000000000283",6,1,"Load","Nylon stockings, bricks and machinery",3437.23,"916638120573","608192987900","Janice Dawson-Nelson",""
"000000000283",7,1,"Unload","Velvet, apples, radium and dogfood",1508.11,"638936607602","160215704798","Nancy K. O'Toole",""
"000000000284",2,1,"Load","Engine parts, ice cream cones and apples",3957.7,"666728522375","","Eduardo Smith","Yancey A. Grimes"
"000000000284",3,1,"Hook","Dogfood, stovepipe hats and uranium",9137.36,"206983406102","","Kevin A. Nelson",""
"000000000284",4,1,"Load","Krazy glue and bricks",9088.06,"915082288679","863322568360","Quincy M. Dawson",""
"000000000284",5,1,"Drop","Gold, radium and hot dog buns",5941.59,"31626569385","567591547696","Nancy Underwood-Perry",""
