OrderId,StopSequenceNumber,CargoChangeSequenceNumber,CargoChangeType,GeneralDescription,Weight,TruckNumber,TrailerNumber,Driver1Name,Driver2Name
"000000000370",8,1,"Unload","Bricks and machinery",7549.58,"279752501318","939583566004","Ulysses Y. Anderson",""
"000000000370",9,1,"Unload","potatoes",6317.91,"651381950028","145075193151","Mitchell W. Ramakrishnan",""
"000000000371",2,1,"Hook","Hot dog buns and krazy glue",6075.97,"93900774774","953098249628","Janice Covington",""
"000000000371",3,1,"Load","radium",8537.01,"398728119585","982138947522","Kevin Q. Underwood",""
"000000000371",4,1,"Hook","Machinery, krazy glue, engine parts and ice cream cones",6826.15,"620583021538","957398823244","Quincy Harrison",""
"000000000371",4,2,"Drop","Bricks, radium and ice cream cones",1010.46,"128133304438","735217847981","Danielle Underwood","Velma R. Benitez-Lewis"
"000000000371",5,1,"Hook","hot dog buns",2042.96,"","479171790442","Janice French",""
"000000000371",5,2,"Drop","Gold and machinery",959.17,"707845204614","457365337184","Nancy Benitez",""
"000000000371",6,1,"Hook","Ice cream cones, quilts and nylon stockings",7089.54,"390511930230","","Janice Q. Covington",""
"000000000371",7,1,"Drop","Nylon stockings and hot dog buns",8840.1,"887266453659","75765753987","George F. Williams",""
"000000000372",2,1,"Hook","lobsters",3930.43,"","","Ulysses Dawson-Perry","Samuel Perry"
"000000000372",3,1,"Hook","Dogfood and engine parts",4589.78,"753016679766","","William Anderson",""
"000000000372",3,2,"Drop","Radium, nylon stockings, engine parts and dogfood",8455.53,"529104210982","636940758591","Ulysses Covington-Mitchell",""
"000000000372",5,1,"Hook","Jogging pants, uranium and turtle eggs",6505.68,"559853322270","811621812629","Mitchell Irvin-Lewis",""
"000000000372",5,2,"Drop","Jogging pants, krazy glue and windows",513.09,"8259568903","","Mitchell E. Smith O'Toole",""
"000000000372",7,1,"Hook","Lobsters, hot dog buns and orange juice",2153.19,"505613615255","551489392455","Janice Grimes",""
"000000000372",7,2,"Drop","Stovepipe hats, lobsters and gold",4746.81,"793144895538","396122891917","Danielle Dawson",""
"000000000372",10,1,"Drop","Turtle eggs and velvet",4342.2,"751429553475","","Harriet P. Irvin Benitez",""
"000000000372",12,1,"Load","Caesar salad mix and hot dog buns",2878.37,"","454933824143","Samuel Nelson","Janice Quasnoy"
"000000000372",12,2,"Drop","Caesar salad mix and turtle eggs",3034.48,"718353658982","","Eduardo Underwood",""
"000000000372",13,1,"Drop","Caesar salad mix, bricks, hot dog buns and dogfood",3082.96,"919981428788","","Isaiah J. Perry",""
"000000000372",14,1,"Unload","Ice cream cones, gold, bricks and hot dog buns",6744.91,"335602992460","621350390319","Samuel T. Kern",""
"000000000373",2,1,"Load","quilts",2913.59,"303005224910","820343434139","Nancy Y. Anderson","Xaviera Covington"
"000000000373",3,1,"Load","x-ray machine parts",3949.15,"948757185383","28081087385","William A. Velazquez",""
"000000000373",4,1,"Load","Apples and turtle eggs",2314.36,"870075300571","108288004044","Janice Mitchell",""
"000000000373",5,1,"Drop","Dogfood and windows",9508.62,"27267158852","557340805892","Harriet M. Thompson-Anderson",""
"000000000374",2,1,"Load","lobsters",6238.13,"457256468329","833706275354","Mitchell S. Xing",""
"000000000374",7,1,"Hook","Jogging pants, dogfood, krazy glue and yoyos",2459.91,"","655219164215","Eduardo V. Williams",""
"000000000374",7,2,"Unload","velvet",3218.07,"338272114303","584131527775","Alfred L. Harrison",""
"000000000374",9,1,"Drop","Windows and velvet",2074.07,"798630333451","975801626971","Kevin V. Mitchell-Benitez",""
"000000000375",2,1,"Load","Jogging pants, quilts and potatoes",9623.36,"169436936270","78180084037","Francis O. Kern",""
"000000000375",3,1,"Load","Gold, lobsters and dogfood",9261.09,"757541312269","","Samuel Dawson",""
"000000000375",4,1,"Hook","Dogfood and velvet",8045.34,"654149494238","622148630587","Velma Xing",""
"000000000375",5,1,"Load","nylon stockings",2002.44,"971911744274","997990980148","Danielle Dawson",""
"000000000375",6,1,"Hook","Apples, yoyos, jogging pants and bricks",1496.66,"287977842458","910600510956","Kevin J. Smith",""
"000000000375",7,1,"Drop","Hot dog buns and radium",8105.19,"430157631336","","Charles Covington",""
"000000000376",2,1,"Hook","flash-frozen french fries",1035.39,"","315957857262","William Grimes-Nelson",""
"000000000376",3,1,"Drop","Apples, lobsters and nylon stockings",8306.81,"438558723951","","Isaiah Williams",""
"000000000376",4,1,"Hook","Windows and stovepipe hats",3713.17,"","7428719546","Samuel K. Kern",""
"000000000376",4,2,"Unload","Hot dog buns, windows, gold and radium",6093.86,"593029237760","934871603664","Oliver Edwards",""
"000000000376",5,1,"Unload","Hot dog buns and x-ray machine parts",6703.52,"689967751727","","Kevin O. Irvin",""
"000000000376",6,1,"Hook","Apples and yoyos",2683.55,"669545277083","584323803958","Samuel Kern Ramakrishnan",""
"000000000376",6,2,"Unload","engine parts",7298.04,"383097675116","573417588651","Danielle Williams",""
"000000000376",8,1,"Hook","Caesar salad mix, orange juice and windows",1811.53,"","862293740746","Alfred U. Jackson",""
"000000000376",8,2,"Unload","Uranium, lobsters, engine parts and nylon stockings",7080.02,"839044777335","664383731773","Danielle Benitez",""
"000000000376",9,1,"Drop","potatoes",3975.23,"401567920872","","Patricia Edwards",""
"000000000377",2,1,"Hook","Ice cream cones and velvet",4824.4,"","","Louise French",""
"000000000377",5,1,"Hook","gold",3707.63,"","","Nancy I. Covington",""
"000000000377",9,1,"Unload","Velvet, ice cream cones, radium and turtle eggs",6784.82,"628738388219","","Ulysses R. Ramakrishnan","Louise A. Benitez"
"000000000378",2,1,"Hook","Gold, krazy glue and velvet",291.34,"889741545701","","William Ramakrishnan",""
"000000000378",3,1,"Unload","Caesar salad mix, dogfood and orange juice",1331.94,"782768363911","","Alfred I. O'Toole",""
"000000000378",4,1,"Hook","Radium, orange juice, potatoes and jogging pants",7365.71,"","649738822658","Velma C. Harrison",""
"000000000378",5,1,"Load","Yoyos, radium and ice cream cones",1405.93,"269790895115","286150902826","William Edwards",""
"000000000378",8,1,"Load","jogging pants",6478.99,"756535427031","","Isaiah N. French",""
"000000000378",9,1,"Unload","Machinery, windows and turtle eggs",1011.43,"610626978807","","Janice Yarbrough","Quincy Irvin Edwards"
"000000000378",10,1,"Hook","Caesar salad mix and engine parts",6018.89,"","79092234382","Velma E. Quasnoy",""
"000000000378",11,1,"Load","Yoyos, hot dog buns and nylon stockings",5285.2,"877701691989","","Roberta Smith",""
"000000000378",12,1,"Hook","Turtle eggs, engine parts, jogging pants and dogfood",6040.64,"","730755288750","Kevin Quasnoy",""
"000000000378",12,2,"Unload","Yoyos, velvet, Caesar salad mix and windows",9764.8,"","160328957235","Roberta X. Smith",""
"000000000378",13,1,"Drop","Gold and krazy glue",7321.93,"708906218319","958503400509","Tammy Xing","William X. Harrison"
"000000000378",14,1,"Drop","Bricks and windows",7790.33,"822672020970","","Samuel C. Mitchell",""
"000000000378",15,1,"Unload","Hot dog buns and ice cream cones",3295.36,"","","Charles Yarbrough",""
"000000000379",2,1,"Load","Turtle eggs, potatoes and flash-frozen french fries",8283.8,"96978864774","632900063295","Samuel D. Thompson",""
"000000000379",3,1,"Load","Bricks, krazy glue and hot dog buns",3892.31,"902166367765","557883874731","William Kern",""
"000000000379",4,1,"Load","quilts",1860.8,"777883715248","","William Dawson",""
"000000000379",5,1,"Load","Potatoes, dogfood and bricks",9176.82,"","406620303953","George Edwards",""
"000000000379",5,2,"Drop","Caesar salad mix, uranium and krazy glue",7480.79,"","650899715889","Nancy Anderson",""
"000000000379",6,1,"Drop","Krazy glue and hot dog buns",7590.57,"","118549789256","Velma Nelson-Irvin",""
"000000000379",8,1,"Hook","quilts",3694.92,"845993262353","908228397499","Alfred I. Benitez",""
"000000000379",9,1,"Hook","Nylon stockings, yoyos, flash-frozen french fries and velvet",7607.74,"122609440510","535761972814","Charles Lewis",""
"000000000379",10,1,"Drop","Turtle eggs and gold",7907.24,"987338464813","868314956470","Betty Ramakrishnan",""
"000000000379",11,1,"Unload","uranium",6688.31,"402464353646","184263560764","Francis Smith",""
"000000000380",2,1,"Load","Engine parts, quilts, uranium and hot dog buns",128.61,"","","Patricia Kern","Alfred F. Harrison"
"000000000380",3,1,"Hook","Velvet, dogfood, radium and x-ray machine parts",3652.79,"797842831118","","Francis J. Irvin",""
"000000000380",3,2,"Drop","Engine parts, uranium and turtle eggs",8219.44,"372662364140","259370011792","Oliver Grimes",""
"000000000380",4,1,"Unload","Gold, flash-frozen french fries and uranium",2544.07,"907508987127","98364849981","Janice Harrison-Ramakrishnan",""
"000000000380",5,1,"Load","Flash-frozen french fries and gold",9051.03,"997886111282","482718091305","Harriet Smith",""
"000000000380",6,1,"Hook","Uranium and radium",8469.61,"","300328459242","George N. Covington","Patricia Irvin"
"000000000380",6,2,"Unload","Bricks and nylon stockings",428.25,"496028256171","822913199112","Kevin Underwood",""
"000000000380",7,1,"Hook","jogging pants",3417.74,"747740948633","142347616773","Isaiah O'Toole",""
"000000000380",9,1,"Drop","quilts",5097.53,"449480807893","657404070187","Yancey R. Underwood-Velazquez",""
"000000000380",10,1,"Drop","Lobsters, jogging pants and orange juice",7892.55,"","878706309860","Mitchell S. Mitchell",""
"000000000381",2,1,"Hook","Turtle eggs, uranium and hot dog buns",6192.56,"458924668225","","Charles J. Williams",""
"000000000381",3,1,"Load","Engine parts, windows, apples and turtle eggs",4234.57,"","350424917140","Harriet Perry",""
"000000000381",6,1,"Hook","Gold and stovepipe hats",9452.92,"60166895085","","Charles Underwood",""
"000000000381",6,2,"Drop","hot dog buns",1875.34,"9457501559","948308251174","Francis E. Jackson",""
"000000000381",8,1,"Hook","Velvet, machinery, krazy glue and Caesar salad mix",6388.81,"471521519596","981595942282","Tammy Quasnoy",""
"000000000381",10,1,"Unload","Krazy glue, machinery and engine parts",7691.47,"","413041487911","Charles Irvin",""
"000000000381",11,1,"Unload","dogfood",2816.79,"","90694727556","William Grimes","Patricia Xing-Velazquez"
"000000000382",2,1,"Hook","nylon stockings",1450.78,"","157309061084","Janice Grimes",""
"000000000382",3,1,"Drop","Krazy glue, gold, dogfood and x-ray machine parts",7628.87,"","654949878147","Samuel O. Williams",""
"000000000382",4,1,"Load","Velvet, dogfood and quilts",9716.15,"804219853863","","Mitchell J. Velazquez-Quasnoy","Louise Ramakrishnan"
"000000000382",6,1,"Hook","Bricks, quilts and lobsters",8271.58,"","747715941301","Tammy French",""
"000000000382",8,1,"Hook","Hot dog buns, potatoes, jogging pants and quilts",4085.88,"549281877543","68209112468","Danielle Kern",""
"000000000382",9,1,"Unload","engine parts",3155.07,"141279407062","","Patricia V. Perry",""
"000000000382",11,1,"Drop","Orange juice and windows",5372.04,"854796164886","45499246407","Kevin L. French-Yarbrough",""
"000000000383",2,1,"Load","Hot dog buns and turtle eggs",8125.81,"821094717824","907652022351","Velma N. Nelson",""
"000000000383",3,1,"Hook","Quilts, Caesar salad mix and x-ray machine parts",7177.91,"","708351600892","Mitchell Q. Thompson",""
"000000000383",7,1,"Load","orange juice",3094.83,"929535841511","696184001311","Roberta T. Anderson-Covington",""
"000000000383",9,1,"Load","radium",4036.25,"","","Betty French",""
"000000000383",9,2,"Unload","Gold and nylon stockings",4753.74,"311968863997","961557237650","Velma Benitez-Harrison",""
"000000000383",10,1,"Drop","Velvet, stovepipe hats and windows",6628.07,"107688376751","496767303094","Danielle Harrison",""
"000000000384",2,1,"Hook","Radium, quilts and krazy glue",618.28,"","148382508726","Francis N. Edwards-Thompson",""
"000000000384",3,1,"Load","Uranium, yoyos, flash-frozen french fries and nylon stockings",8187.52,"74584980370","","Samuel C. Williams","Harriet Edwards"
"000000000384",5,1,"Hook","Apples, jogging pants and turtle eggs",6717.97,"407023511692","","George T. Harrison","Quincy Williams"
"000000000384",6,1,"Drop","Flash-frozen french fries, orange juice and hot dog buns",3036.33,"","522237601687","Danielle Yarbrough",""
"000000000385",2,1,"Load","potatoes",6353.65,"","616639479724","Oliver Perry",""
"000000000385",3,1,"Hook","gold",2694.26,"427020801599","804608694940","Charles K. Mitchell","Kevin O. Williams"
"000000000385",4,1,"Drop","bricks",4835.58,"347810478570","505061207964","Kevin F. Nelson",""
"000000000386",2,1,"Load","Apples, engine parts and flash-frozen french fries",8460.93,"730883774556","854807593086","Janice U. Xing",""
"000000000386",3,1,"Drop","Machinery and bricks",2661.47,"289676724042","389625773084","Nancy Velazquez-Mitchell","Tammy U. Anderson"
"000000000386",5,1,"Hook","Potatoes and radium",3792.03,"","","William Nelson Williams",""
"000000000386",5,2,"Unload","radium",4096.53,"","754766984175","Quincy Anderson",""
"000000000386",6,1,"Unload","Lobsters, Caesar salad mix and potatoes",5348.74,"130617945531","917901986397","Xaviera V. Benitez",""
"000000000387",2,1,"Load","Nylon stockings, velvet and gold",6375.39,"71750617479","886002961142","Janice Velazquez",""
"000000000387",3,1,"Load","Turtle eggs, radium and Caesar salad mix",7630.66,"473688625095","","Eduardo M. Xing-Perry",""
"000000000387",4,1,"Unload","flash-frozen french fries",7220.52,"20869522933","","Betty K. Ramakrishnan",""
"000000000387",5,1,"Hook","bricks",668.74,"854619784326","435126063235","Nancy U. Lewis",""
"000000000387",6,1,"Hook","Radium, Caesar salad mix and engine parts",238.74,"","957737515123","Charles Edwards",""
"000000000387",7,1,"Hook","Potatoes, Caesar salad mix, machinery and yoyos",5390.67,"","398515430731","Mitchell Nelson",""
"000000000387",8,1,"Load","Flash-frozen french fries, lobsters and Caesar salad mix",167.48,"694098760250","749202552132","Xaviera M. Yarbrough",""
"000000000387",9,1,"Load","ice cream cones",3714.16,"95374299439","653972672692","Oliver Williams",""
"000000000387",9,2,"Unload","Krazy glue, radium, uranium and lobsters",1718.87,"843854479442","70018804641","Quincy Perry","Xaviera Grimes"
"000000000387",10,1,"Unload","Flash-frozen french fries, lobsters, x-ray machine parts and bricks",5130.03,"150463726344","32565430304","Ulysses Irvin",""
"000000000388",2,1,"Load","Caesar salad mix",3851.74,"718506221309","","Nancy I. Anderson","Nancy Grimes"
"000000000388",3,1,"Load","Engine parts, bricks and jogging pants",4367.65,"","347802940106","Patricia A. Dawson",""
"000000000388",5,1,"Load","krazy glue",5263.16,"703049693364","184605211714","Patricia Nelson-Yarbrough",""
"000000000388",5,2,"Drop","Caesar salad mix, machinery, ice cream cones and windows",9080.54,"","653010675297","Ulysses J. Dawson","Mitchell Harrison"
"000000000388",6,1,"Load","X-ray machine parts, flash-frozen french fries and engine parts",4163.39,"452744697395","587481366567","Samuel F. Quasnoy","Danielle W. Smith Kern"
"000000000388",6,2,"Drop","Bricks, Caesar salad mix, krazy glue and velvet",2628.43,"","889976962595","Harriet Covington",""
"000000000388",10,1,"Drop","Lobsters, radium and flash-frozen french fries",5204.61,"170761479448","","Yancey French",""
"000000000389",2,1,"Hook","Yoyos, uranium and jogging pants",4337.17,"166140419797","","Samuel Anderson",""
"000000000389",3,1,"Load","Gold and Caesar salad mix",9934.83,"","991821528053","Charles Anderson-Grimes",""
"000000000389",4,1,"Load","Caesar salad mix, jogging pants, x-ray machine parts and windows",3944.22,"","","Patricia French",""
"000000000389",5,1,"Unload","Windows and krazy glue",7876.86,"850665701227","945627610808","Samuel Thompson Covington","Kevin Mitchell"
"000000000389",6,1,"Drop","Bricks and quilts",8310.74,"944376038106","993854903083","Quincy B. Underwood","Nancy Jackson"
"000000000389",7,1,"Load","Uranium, windows and gold",1800.32,"","","Nancy Williams-Jackson",""
"000000000389",8,1,"Load","Quilts, engine parts and gold",4156.3,"","178938307382","Ulysses R. Nelson-Yarbrough",""
"000000000389",9,1,"Unload","Yoyos, bricks, nylon stockings and machinery",1011.3,"281056220038","67130890474","George Edwards",""
"000000000389",10,1,"Load","Apples and turtle eggs",9764.17,"997785682929","992869172835","Ulysses X. Mitchell",""
"000000000389",11,1,"Drop","Gold and yoyos",8613.53,"330481008720","","Samuel Edwards",""
"000000000390",2,1,"Load","Velvet, dogfood and potatoes",990.79,"20582631635","","Mitchell Quasnoy",""
"000000000390",3,1,"Load","Turtle eggs, jogging pants and apples",5506.01,"893900392776","","Isaiah Yarbrough",""
"000000000390",3,2,"Drop","Stovepipe hats and orange juice",9894.29,"963024430924","240062880032","Tammy A. Dawson",""
"000000000390",4,1,"Drop","Bricks, stovepipe hats and orange juice",8058.93,"41422037451","324394920340","Isaiah U. Underwood Velazquez","Ulysses Kern"
"000000000390",5,1,"Unload","Windows, yoyos, bricks and machinery",3351.46,"201931691178","227574210860","Patricia Harrison-Dawson",""
"000000000391",2,1,"Load","Orange juice and krazy glue",6531.85,"928446249574","12309468992","Nancy Smith Underwood",""
"000000000391",4,1,"Load","Lobsters, bricks and machinery",2570.68,"1308979546","599278531253","Danielle L. Benitez","Yancey Covington"
"000000000391",5,1,"Unload","Apples, krazy glue and windows",9163.34,"654206454067","95998247707","Isaiah Edwards",""
"000000000392",2,1,"Hook","jogging pants",8080.82,"166579192758","180829942101","Oliver Harrison",""
"000000000392",3,1,"Hook","Radium and ice cream cones",7015.2,"298480804986","501508444657","Alfred Q. Jackson","Tammy Harrison"
"000000000392",3,2,"Drop","yoyos",7929.37,"","","Ulysses A. Nelson",""
"000000000392",6,1,"Load","Potatoes, nylon stockings and machinery",198.85,"","160249996311","Eduardo Mitchell",""
"000000000392",7,1,"Hook","bricks",7644.38,"845846771486","","Kevin B. Benitez",""
"000000000392",7,2,"Drop","X-ray machine parts and ice cream cones",1051.33,"368924147652","","Samuel V. Kern","Roberta Yarbrough-Thompson"
"000000000392",10,1,"Hook","Apples and turtle eggs",6025.91,"","","George B. Smith","Charles H. Ramakrishnan-Perry"
"000000000392",10,2,"Unload","Hot dog buns, stovepipe hats and quilts",8375.99,"","191165930532","Quincy S. Dawson",""
"000000000392",11,1,"Drop","Velvet, ice cream cones and potatoes",3603.2,"","652838377536","Eduardo Harrison-Underwood",""
"000000000393",2,1,"Hook","Potatoes and engine parts",7741.47,"631106412444","","Kevin Q. Xing","Roberta A. Yarbrough"
"000000000393",3,1,"Load","Uranium, nylon stockings and apples",1326.45,"271120771870","","George Nelson-Grimes",""
"000000000393",3,2,"Drop","hot dog buns",9334.39,"265306026572","658907560238","Kevin Harrison",""
"000000000393",4,1,"Unload","Nylon stockings, krazy glue and potatoes",8902.15,"558383581153","186252158527","Xaviera W. Ramakrishnan",""
"000000000393",5,1,"Hook","Apples, uranium and bricks",7748.06,"57162065737","780595053270","Kevin R. Velazquez Grimes",""
"000000000393",5,2,"Unload","yoyos",9774.13,"699978131017","927524555936","Charles P. Dawson Lewis",""
"000000000393",6,1,"Load","Uranium, lobsters and potatoes",9286.92,"261235690980","938880816589","Charles F. Perry Lewis",""
"000000000393",6,2,"Drop","stovepipe hats",2709.39,"280770253696","961367813843","Patricia Smith",""
"000000000393",7,1,"Unload","Jogging pants and yoyos",6697.88,"","816277253907","Janice W. Quasnoy",""
"000000000393",9,1,"Hook","X-ray machine parts, radium and orange juice",2277.12,"575160640824","","Harriet Thompson",""
"000000000393",9,2,"Drop","Turtle eggs and orange juice",2024.24,"","204827771929","Louise U. Quasnoy",""
"000000000393",10,1,"Load","Flash-frozen french fries, yoyos and krazy glue",8634.98,"","527393653414","Quincy F. O'Toole Kern",""
"000000000393",10,2,"Unload","orange juice",2527.43,"622149311620","470128989487","Eduardo Quasnoy",""
"000000000393",11,1,"Drop","Ice cream cones and jogging pants",9765.18,"800357142759","","Ulysses Lewis",""
"000000000394",2,1,"Load","Yoyos, hot dog buns and orange juice",1517.91,"555326648967","19916392389","Danielle Lewis",""
"000000000394",3,1,"Load","Velvet, quilts, radium and bricks",7585.53,"394320925775","191943822864","Oliver Yarbrough",""
"000000000394",4,1,"Load","Apples and Caesar salad mix",2587.39,"724065548513","998612584855","Velma Grimes",""
"000000000394",6,1,"Unload","Flash-frozen french fries, Caesar salad mix and radium",1720.49,"433468639351","147280139865","Tammy Dawson",""
"000000000395",2,1,"Hook","Turtle eggs and orange juice",1627.84,"431028082196","","William Velazquez Covington",""
"000000000395",3,1,"Hook","Machinery, apples and windows",1422.19,"","72035674124","Roberta Y. Thompson-Yarbrough",""
"000000000395",5,1,"Unload","Potatoes and dogfood",2765.33,"31992750470","487123755329","Yancey T. Irvin",""
"000000000396",2,1,"Hook","Lobsters, yoyos and gold",3548.63,"803599490055","576229638691","Oliver Quasnoy",""
"000000000396",3,1,"Unload","Radium, engine parts, quilts and krazy glue",9503.59,"226573111406","","Betty O. Jackson",""
"000000000396",5,1,"Hook","Gold, lobsters, krazy glue and Caesar salad mix",4548.46,"","705173229492","William Perry","Danielle W. Lewis"
"000000000396",5,2,"Drop","orange juice",9275.73,"","970723752759","Isaiah French Perry","Danielle Benitez"
"000000000396",7,1,"Drop","Potatoes, uranium, jogging pants and hot dog buns",307.7,"","294297977173","Eduardo H. Nelson",""
"000000000396",8,1,"Drop","Radium, x-ray machine parts and dogfood",3786.09,"858611764514","455296289375","Nancy Yarbrough",""
"000000000397",2,1,"Hook","apples",7168.56,"786743185420","","Nancy Ramakrishnan",""
"000000000397",3,1,"Hook","Quilts and Caesar salad mix",5510.99,"121921140871","117633467732","Velma O'Toole","Patricia Quasnoy-Smith"
"000000000397",4,1,"Drop","Orange juice and x-ray machine parts",7806.72,"","427909907323","Tammy I. Ramakrishnan",""
"000000000397",5,1,"Load","Stovepipe hats, krazy glue and engine parts",2119.4,"405533866292","184317629099","Mitchell Quasnoy",""
"000000000397",6,1,"Unload","Uranium and stovepipe hats",7994.69,"","730271096788","Xaviera P. Benitez",""
"000000000397",7,1,"Drop","Bricks, uranium and gold",8826.38,"554421584911","707731449699","Roberta Irvin",""
"000000000398",2,1,"Load","Orange juice, stovepipe hats, nylon stockings and gold",9143.12,"","271143400810","Louise Williams","Tammy French"
"000000000398",3,1,"Drop","Dogfood and windows",8573.05,"490281830460","216642907538","Patricia V. Dawson-Grimes",""
"000000000398",4,1,"Hook","Uranium, Caesar salad mix and orange juice",5098.34,"320101406915","","Kevin Thompson",""
"000000000398",5,1,"Drop","Stovepipe hats and nylon stockings",2396.04,"166264488865","679165634709","Roberta Anderson-Quasnoy",""
"000000000398",6,1,"Unload","Machinery, turtle eggs, apples and bricks",3542.73,"","832831463930","Xaviera A. Williams",""
"000000000398",7,1,"Unload","Lobsters, bricks, uranium and potatoes",2138.87,"517249300260","","Louise I. Quasnoy",""
"000000000398",8,1,"Drop","Dogfood, turtle eggs, x-ray machine parts and krazy glue",7444.79,"393406467744","264938431049","Patricia Anderson",""
"000000000399",2,1,"Hook","Apples and stovepipe hats",7082.1,"201410340564","49017517735","Louise P. O'Toole",""
"000000000399",3,1,"Hook","Potatoes, krazy glue, orange juice and engine parts",7025.74,"","732511849596","Danielle Yarbrough",""
"000000000399",3,2,"Drop","Velvet and stovepipe hats",6755.92,"635156281383","","Ulysses Perry",""
"000000000399",4,1,"Unload","apples",4305.9,"307327206862","672071811842","Isaiah E. Underwood",""
"000000000399",5,1,"Unload","Hot dog buns and ice cream cones",4775.71,"422284140753","753218254471","Kevin Grimes",""
"000000000399",6,1,"Unload","Machinery and flash-frozen french fries",9947.03,"613792068601","140022168577","Nancy K. Thompson",""
"000000000399",7,1,"Hook","Caesar salad mix and lobsters",904.55,"167955185746","","William Perry",""
"000000000399",7,2,"Unload","Velvet, machinery and yoyos",3024.03,"","842361367748","Danielle Velazquez",""
"000000000399",8,1,"Drop","Stovepipe hats, krazy glue and lobsters",1296.89,"571511393063","238844897753","Samuel M. Anderson","Velma O'Toole"
"000000000399",9,1,"Drop","Orange juice and Caesar salad mix",6502.18,"793902237260","329510165229","Ulysses Grimes",""
"000000000399",10,1,"Unload","stovepipe hats",2265.21,"","402738713153","Nancy Quasnoy",""
"000000000400",2,1,"Load","Machinery, radium, hot dog buns and orange juice",8843.35,"","","Charles T. Grimes",""
"000000000400",3,1,"Drop","Windows, uranium and Caesar salad mix",7064.49,"776964413018","350087292561","Betty Xing",""
"000000000400",5,1,"Unload","Krazy glue, x-ray machine parts, uranium and bricks",5629.01,"958897102132","","Ulysses Ramakrishnan",""
"000000000400",6,1,"Hook","quilts",4014.03,"","","Velma N. Irvin","Roberta T. Anderson"
"000000000400",6,2,"Unload","Velvet, Caesar salad mix and bricks",1207.26,"","608703383760","George D. Velazquez","Ulysses Xing-Jackson"
"000000000400",7,1,"Unload","Ice cream cones, quilts, engine parts and gold",5642.96,"","513032170358","Kevin S. Mitchell",""
"000000000401",2,1,"Hook","Quilts and machinery",7010.84,"19729517715","993172987091","Betty G. Benitez-Covington",""
"000000000401",3,1,"Hook","Caesar salad mix, apples, yoyos and lobsters",2364.81,"193003783586","135479837396","Samuel Williams",""
"000000000401",3,2,"Drop","Windows, yoyos, bricks and flash-frozen french fries",488,"175310752953","344527783549","Mitchell J. Covington",""
"000000000401",4,1,"Unload","Apples, x-ray machine parts and stovepipe hats",1802.79,"717471667090","275797081138","Xaviera Jackson","Janice T. Xing"
"000000000401",5,1,"Unload","Bricks, windows and velvet",3319.31,"766944495296","","Kevin G. Smith",""
"000000000401",6,1,"Drop","Nylon stockings, uranium, potatoes and yoyos",2927.5,"189160707884","6635916804","Eduardo A. Grimes-Thompson",""
